,username.1,name,day of publication,textclean,sentiment,helper
3249,mark_dow,Dow,2022-07-03,rt alancarroii your next task is to make money on nfts httpstcondibso0esc,NEGATIVE,-1
3250,mark_dow,Dow,2022-07-03,final result 70 yes 30 no httpstcobnyguxteaw,NEGATIVE,-1
3251,mark_dow,Dow,2022-07-03,babs5we you dont think hes guilty,NEGATIVE,-1
3252,mark_dow,Dow,2022-07-03,current positioning httpstcogza4b0x1w7,NEGATIVE,-1
3253,mark_dow,Dow,2022-07-03,hard to imagine not bringing charges against trump at this point given how much everyone now knows itd be a huge blow to the rule of law if they didnt httpstcoakxdumsafu,NEGATIVE,-1
3254,mark_dow,Dow,2022-07-03,long spx short bitcoin httpstcovcmleeqkbs,NEGATIVE,-1
3255,mark_dow,Dow,2022-07-03,nat gas down 15 in 24hrs ngf,NEGATIVE,-1
3256,mark_dow,Dow,2022-07-03,youre never gonna get me copper httpstcofmnmzn0ygx,NEGATIVE,-1
3257,mark_dow,Dow,2022-07-03,"rt kylascan are we manifesting a recession

we seem to be in a vibecession  a period of temporary vibe decline where the economic data…",NEGATIVE,-1
3258,mark_dow,Dow,2022-07-03,the environment was a lot cleaner in 1787,NEGATIVE,-1
3259,mark_dow,Dow,2022-07-03,invest4millionz speculation unwind refiner normalization,NEGATIVE,-1
3260,mark_dow,Dow,2022-07-03,morgan03 cavandy httpstcoejwaezyv7c,NEGATIVE,-1
3261,mark_dow,Dow,2022-07-03,hate to be the bearer of good news but httpstco6qotbcxyqu,NEGATIVE,-1
3262,mark_dow,Dow,2022-07-03,commodities httpstco36e2mui2xq,NEGATIVE,-1
3263,pearkes,George Pearkes,2022-12-08,conorsen heres nsa continuing claims for 20172019 and this year each series is set to first 39 weeks of year  100 thanksgiving week typically sees a big spike but relative to ytd trend we are way higher now than the precovid norm and had been underperforming into turkey day too httpstconnqfrg1qlo,NEGATIVE,-1
3264,pearkes,George Pearkes,2022-12-08,"rt paulisci a brief history of kids today are spoiled

🧵",NEGATIVE,-1
3265,pearkes,George Pearkes,2022-12-08,kylef hassankhan cdhooks water is a big deal but keep in mind we export azgrown alfalfa to saudi arabia so where theres a will theres a way also low humidity is v good for yields to my understanding so theres puts and takes on the climate in az for semis manufacturing,NEGATIVE,-1
3266,pearkes,George Pearkes,2022-12-08,sidverma also looks like that expired about 3 months ago careful eating it,NEGATIVE,-1
3267,pearkes,George Pearkes,2022-12-08,sidverma reading sid posts httpstcodwsiu67vc0,NEGATIVE,-1
3268,pearkes,George Pearkes,2022-12-08,modestproposal1 its going to be so much easier to do economy when most people dont care what gas prices are doing,NEGATIVE,-1
3269,pearkes,George Pearkes,2022-12-08,vegavandal conorsen reshorenow its pretty remarkable and i think the ira is definitely helping but a lot of the groundwork for these preceded it by a long time,POSITIVE,1
3270,pearkes,George Pearkes,2022-12-08,vegavandal conorsen reshorenow yeah where it gets confused is that some of this is reshoring and some of it is just new greenfield capex in sectors that already do a lot of domestic production eg truck assembly,NEGATIVE,-1
3271,pearkes,George Pearkes,2022-12-08,does anyone have a tracker of batterysemisev manufacturing greenfield development announcements it feels like the numbers are starting to get big enough to move some needles in the nipas though maybe thats a filter bias on my part,NEGATIVE,-1
3272,pearkes,George Pearkes,2022-12-08,"sk already has a plant on the other side of the atlanta metro in jackson county which nyt profiled over the summer interesting read httpstcogqdlxk7lur

hyundai motorsk on to build ev battery plant in bartow county",NEGATIVE,-1
3273,pearkes,George Pearkes,2022-12-08,tolstoybb hassankhan one of the most disappointing takes i’ve ever seen it’s the exact same vibe as the former president who had a tantrum over wind development near one of his golf courses in scotland,NEGATIVE,-1
3274,pearkes,George Pearkes,2022-12-08,3747s14458e idk the boss handles all these transactions,NEGATIVE,-1
3275,pearkes,George Pearkes,2022-12-08,we’ve started a modest collection of foodthemed christmas ornaments salmon nigiri tinned fish salmon roe nigiri everything bagel getting hungry over here httpstcou87dnqwq7l,NEGATIVE,-1
3276,pearkes,George Pearkes,2022-12-08,hmeisler narrativemachi1 capitaledgeny carlquintanilla okay this should help,NEGATIVE,-1
3277,pearkes,George Pearkes,2022-12-08,veryfinanceguy this is part of a broader phenomenon where you replace “funding market analyst” with “hyper niche finance subject matter de jour”,NEGATIVE,-1
3278,pearkes,George Pearkes,2022-12-08,need much lager mortgage rate declines to get purchase apps properly moving imo down wow after a bit of a bounce httpstcoehhngibeub,NEGATIVE,-1
3279,pearkes,George Pearkes,2022-12-08,rt jacobrubashkin in 1934 no democratic senators lost reelection but since 1934 every president democrat and republican has seen at…,POSITIVE,1
3280,pearkes,George Pearkes,2022-12-08,rt redistrict ive seen enough sen raphael warnock d defeats herschel walker r in the gasen runoff giving democrats a 5149 major…,NEGATIVE,-1
3281,pearkes,George Pearkes,2022-12-08,tylerdinucci hopes and dreams lt addition and subtraction,POSITIVE,1
3282,pearkes,George Pearkes,2022-12-08,redistrict httpstco0ugsnrdmsh,NEGATIVE,-1
3283,pearkes,George Pearkes,2022-12-08,oncallprofile no hoping left to do in either direction 928 dekalb drop means buy byeeee to walker game over,NEGATIVE,-1
3284,pearkes,George Pearkes,2022-12-08,dekalb httpstcorfj4e2uivz,NEGATIVE,-1
3285,pearkes,George Pearkes,2022-12-08,alanmyron dsquareddigest popehat mtaibbi bariweiss httpstcod6dznvvxgn httpstcojpbcbxf5ue,NEGATIVE,-1
3286,pearkes,George Pearkes,2022-12-08,"rt populismupdates nyt just before results behold our completely wondrous whimsical and fantastical the one and only needle

nyt du…",POSITIVE,1
3287,pearkes,George Pearkes,2022-12-08,dsquareddigest popehat mtaibbi bariweiss i would be pretty surprised if elon knew that said acronym existed,NEGATIVE,-1
3288,pearkes,George Pearkes,2022-12-08,markets people take one look at a bunch of correlated stuff doing the same thing and draw conclusions election twitter is more cautious but if you’re waiting for more you’re going to lag the reality that warnock has won,NEGATIVE,-1
3289,pearkes,George Pearkes,2022-12-08,"rt jacobrubashkin in crucial chattahoochee county walker is significantly underperforming his 118 mark

with gt95 per nyt walker lead…",NEGATIVE,-1
3290,pearkes,George Pearkes,2022-12-08,"rt hjessy fully reporting baldwin county

eday
walker 111 ➡️ walker 114

vbm
warnock 461 ➡️ warnock 362

early
walker 06 ➡️…",POSITIVE,1
3291,pearkes,George Pearkes,2022-12-08,rt popehat mtaibbi bariweiss so neither you nor bari knew jim baker was inhouse counsel at twitter and would obviously be involved in…,NEGATIVE,-1
3292,pearkes,George Pearkes,2022-12-08,rt firstsquawk tsmc announces updates for tsmc arizona  taiwan semiconductor manufacturing co ltdhas started construction of second fa…,NEGATIVE,-1
3293,pearkes,George Pearkes,2022-12-08,first time i’ve started to buy in to the advertiser flight narrative based on my tl tbh httpstcokfm97zv7ge,NEGATIVE,-1
3294,pearkes,George Pearkes,2022-12-08,blairreeves dear god,POSITIVE,1
3295,pearkes,George Pearkes,2022-12-08,conorsen beat you to it httpstcorfbgv3pzkl,POSITIVE,1
3296,pearkes,George Pearkes,2022-12-08,"ms it really is that simple yes
httpstcomeruoanxbx",POSITIVE,1
3297,pearkes,George Pearkes,2022-12-08,deadcaitbounce we are both in welltippled company it seems ☺️,NEGATIVE,-1
3298,pearkes,George Pearkes,2022-12-08,jamiepastore9 correct it’s a whole vibe,POSITIVE,1
3299,pearkes,George Pearkes,2022-12-08,what a great choice to help pedal charlotte forward into a more bikeable future httpstcos6jdmm3bnf,POSITIVE,1
3300,pearkes,George Pearkes,2022-12-08,deadcaitbounce wait why do you have a pearkes bar sign 🤔🤔🤔,NEGATIVE,-1
3301,pearkes,George Pearkes,2022-12-08,jsoloff only for noncocktail enjoyers,NEGATIVE,-1
3302,pearkes,George Pearkes,2022-12-08,birthday americano httpstcopssjmfbtrz,NEGATIVE,-1
3303,pearkes,George Pearkes,2022-12-08,vegavandal yea im talking to them 🥁,NEGATIVE,-1
3304,pearkes,George Pearkes,2022-12-08,xvrmdf i was able to see this earlier but now i canti think he blocked me for it lol,NEGATIVE,-1
3305,pearkes,George Pearkes,2022-12-08,macrocephalopod httpstcod7i76extqt,NEGATIVE,-1
3306,pearkes,George Pearkes,2022-12-08,it cant really be this simple right httpstco0skpa7jm4e,NEGATIVE,-1
3307,pearkes,George Pearkes,2022-12-08,mleewalsh ah,NEGATIVE,-1
3308,pearkes,George Pearkes,2022-12-08,mleewalsh sorry what do you mean,NEGATIVE,-1
3309,pearkes,George Pearkes,2022-12-08,panthers releasing baker mayfield incredible scenes,POSITIVE,1
3310,pearkes,George Pearkes,2022-12-08,hmeisler you could still send them for the holidays,NEGATIVE,-1
3311,pearkes,George Pearkes,2022-12-08,hmeisler ty,NEGATIVE,-1
3312,pearkes,George Pearkes,2022-12-08,rt allezlesboulez cdhooks inthesedeserts maxbluer bbcwomanshour hadleyfreeman emmabarnett httpstcoeh7gqgm3ax,NEGATIVE,-1
3313,pearkes,George Pearkes,2022-12-08,itsatbex similar for sure though its not literally looking at them,NEGATIVE,-1
3314,pearkes,George Pearkes,2022-12-08,bonecondor crank opinions arent necessarily bad but boy are they crank,NEGATIVE,-1
3315,pearkes,George Pearkes,2022-12-08,my most crank opinion is that elf on the shelf is horrible parenting for exactly this reason httpstcoolspi4o49s,NEGATIVE,-1
3316,pearkes,George Pearkes,2022-12-08,maddelarosa matiaskaplan if i was writing a book about mexican cuisine or holding forth as some expert sure i’m tweaking a friend deep in the mentions when we both speak english where tomatillo and tomato are clearly different words as they are different species idk what to tell you lol,POSITIVE,1
3317,pearkes,George Pearkes,2022-12-08,maddelarosa matiaskaplan tomatillo are definitely not tomato though you can’t eat them without cooking them and they’re a completely different species even though they appear similar,POSITIVE,1
3318,pearkes,George Pearkes,2022-12-08,coolp1np yurts for wellness retreats,POSITIVE,1
3319,pearkes,George Pearkes,2022-12-08,maddelarosa matiaskaplan i was thinking verde i admit chilaquiles rojos have tomatoes,NEGATIVE,-1
3320,pearkes,George Pearkes,2022-12-08,newriverinvest my brother in christ this is far too much caffeine for you httpstcojrqlxsbses,NEGATIVE,-1
3321,pearkes,George Pearkes,2022-12-08,matiaskaplan verde gt rojo,NEGATIVE,-1
3322,pearkes,George Pearkes,2022-12-08,matiaskaplan chico you’re putting salsa on chips and calling it chilaquiles httpstcozzmreejxzh,NEGATIVE,-1
3323,pearkes,George Pearkes,2022-12-08,matiaskaplan chilaquiles don’t have tomato or wheat,NEGATIVE,-1
3324,pearkes,George Pearkes,2022-12-08,matiaskaplan no,NEGATIVE,-1
3325,pearkes,George Pearkes,2022-12-08,vegavandal tempting fate here a bit aren’t we,NEGATIVE,-1
3326,pearkes,George Pearkes,2022-12-08,newriverinvest this is why i work out midday every day tbh,NEGATIVE,-1
3327,pearkes,George Pearkes,2022-12-08,christinatoms hm,NEGATIVE,-1
3328,pearkes,George Pearkes,2022-12-08,sillyspreads 😖,NEGATIVE,-1
3329,pearkes,George Pearkes,2022-12-08,bobvols what am i watching lmao,NEGATIVE,-1
3330,pearkes,George Pearkes,2022-12-08,rienzokennedy apologies for stumbling across a gem,NEGATIVE,-1
3331,pearkes,George Pearkes,2022-12-08,34bps brandonjmu it’s the cheese for me,NEGATIVE,-1
3332,pearkes,George Pearkes,2022-12-08,extremely worried about the uk httpstcoysncstxec8,NEGATIVE,-1
3333,pearkes,George Pearkes,2022-12-08,rt gwenfulton when you fall for the protecting kids bullshit you are associating yourself with violent extremists like rainey and the…,NEGATIVE,-1
3334,pearkes,George Pearkes,2022-12-08,httpstcokded4wvvmn httpstcoxf0qhofepd,NEGATIVE,-1
3335,pearkes,George Pearkes,2022-12-08,aharter1 httpstcoepujbmqy5f,NEGATIVE,-1
3336,pearkes,George Pearkes,2022-12-08,metachuckschick man you do not remember what the mid2000s were like…wasn’t stopping anyone back then constant sheer panic and hyperbole,NEGATIVE,-1
3337,pearkes,George Pearkes,2022-12-08,brandonjmu yea eventually but for the time being the sheriff doesn’t know if they were white it’s an initial report wild,NEGATIVE,-1
3338,pearkes,George Pearkes,2022-12-08,was it vandalism or terrorism i don’t know i’d have to think about it longer than i care to…in either 2005 or now but the politics of this sort of thing sure have changed that much is certain,POSITIVE,1
3339,pearkes,George Pearkes,2022-12-08,fascinating to see this framed as vandalism rather than terrorism imagine telling someone in 2005 that a sheriff was calling an armed attack on critical infrastructure in the heartland “vandalism” they’d try to have you committed httpstco2ngxfqs3sj,POSITIVE,1
3340,pearkes,George Pearkes,2022-12-08,yaketystax i mean yea 100 but i’ve had it three weeks so too early to have an opinion on that,NEGATIVE,-1
3341,pearkes,George Pearkes,2022-12-08,security guard told me the radio lit up when i cracked the frunk to get turkey oil dumped out “is that guy dumping his motor oil” nope don’t have any of that,NEGATIVE,-1
3342,pearkes,George Pearkes,2022-12-08,highlight of the day today was hauling 1500 pounds of dead pine to the county mulching facility and having a hard time realizing i had anything in the truck,NEGATIVE,-1
3343,pearkes,George Pearkes,2022-12-08,"rt davekarpf musk and taibbi are tapping into that well of resentment 

why should we care about the president’s adult failson who doesn…",NEGATIVE,-1
3344,pearkes,George Pearkes,2022-12-08,rt conorsen ai will be able to replicate davos speeches by important globalcorporate leaders with so much accuracy that it might be a li…,POSITIVE,1
3345,pearkes,George Pearkes,2022-12-08,👀👀👀 httpstcoeed7culokm,NEGATIVE,-1
3346,pearkes,George Pearkes,2022-12-08,rt redditcfb wake up it’s gameday 🇺🇸⚽️🏈🏆,POSITIVE,1
3347,pearkes,George Pearkes,2022-12-08,alexbhturnbull1 👀👀👀,NEGATIVE,-1
3348,pearkes,George Pearkes,2022-12-08,bkmacd foolallthetime 34bps mayfaircynic love how it just plants no bounce or whatever just smoosh,NEGATIVE,-1
3349,pearkes,George Pearkes,2022-12-08,bkmacd contextproblem okay it just kind of read that way to me,POSITIVE,1
3350,pearkes,George Pearkes,2022-12-08,bkmacd contextproblem theres no right answer here but the claim youre making is pretty serious and your response here edges towards making the original claim unfalsifiable so idk what to do with all this,NEGATIVE,-1
3351,pearkes,George Pearkes,2022-12-08,bkmacd contextproblem ehhhhh i think a bit of hyperbole from our guy can be explained without slapping a full misogyny label on him but ymmv,NEGATIVE,-1
3352,pearkes,George Pearkes,2022-12-08,there are a lot of much worse calendars to reflect the party and its demographicideological priorities imo httpstco5owfgfsbdv,NEGATIVE,-1
3353,pearkes,George Pearkes,2022-12-08,aeiffel95 i dont think its been a disaster at all,NEGATIVE,-1
3354,pearkes,George Pearkes,2022-12-08,revhowardarson quantian1 i think its for clyburn to endorse biden in 2024 thonot something we can know from outside but thats my view,POSITIVE,1
3355,pearkes,George Pearkes,2022-12-08,srbsui absolute bedlam,NEGATIVE,-1
3356,pearkes,George Pearkes,2022-12-08,quantian1 revhowardarson yeah i suspect this is some sort of quid pro quo with clyburn,NEGATIVE,-1
3357,pearkes,George Pearkes,2022-12-08,contextproblem eriz35 honestly one of the worst politicians out there just horrible lol,NEGATIVE,-1
3358,pearkes,George Pearkes,2022-12-08,contextproblem incidentally i disagree with his original post here but my disagreement isnt really mutually exclusive with his conclusion so who care,NEGATIVE,-1
3359,pearkes,George Pearkes,2022-12-08,contextproblem where do you and him find these deeply refined sorts of unhinged posters its remarkable,POSITIVE,1
3360,pearkes,George Pearkes,2022-12-08,contextproblem what are they getting theo for today,NEGATIVE,-1
3361,pearkes,George Pearkes,2022-12-08,that korean goal was absolutely phenomenal,POSITIVE,1
3362,pearkes,George Pearkes,2022-12-08,httpstcowgj8g30xwo httpstcopwkknwyjnu,NEGATIVE,-1
3363,pearkes,George Pearkes,2022-12-02,early days but numbers starting to build httpstcoftaghm4meq,NEGATIVE,-1
3364,pearkes,George Pearkes,2022-12-02,jcecon is there precedent for this sort of thing,NEGATIVE,-1
3365,pearkes,George Pearkes,2022-12-02,curious how avik feels about this one today httpstcovdm0n7c86i,NEGATIVE,-1
3366,pearkes,George Pearkes,2022-12-02,rickywlmsbong cant believe you put that out there in the universe man,NEGATIVE,-1
3367,pearkes,George Pearkes,2022-12-02,httpstcopfhhhmefyz,NEGATIVE,-1
3368,pearkes,George Pearkes,2022-12-02,"one trick bond short ponty

bridgewater erases most of its 2022 gains after twomonth rout",NEGATIVE,-1
3369,pearkes,George Pearkes,2022-12-02,jobs day spaces with conorsen and irvingswisher in about an hour and a half httpstcopfhhhmvqxz,NEGATIVE,-1
3370,pearkes,George Pearkes,2022-12-02,buuuuhhhhh lmao httpstcog99vsextxn,NEGATIVE,-1
3371,pearkes,George Pearkes,2022-12-02,squarelyrooted can i steal this,NEGATIVE,-1
3372,pearkes,George Pearkes,2022-12-02,rt bjudah fact — reflected in this state dinner — there are some extremely good american artisanal cheese these days europrovincialism…,POSITIVE,1
3373,pearkes,George Pearkes,2022-12-02,"schumer says deal reached to vote on bill to avoid rail strike

senate overrides union vote",POSITIVE,1
3374,pearkes,George Pearkes,2022-12-02,rt edsbs httpstcokbvwuomfn7,NEGATIVE,-1
3375,pearkes,George Pearkes,2022-12-02,dmdebruijn i did good fun though i would argue there was some serious shortfalls of quality from one particular belgian around the net,POSITIVE,1
3376,pearkes,George Pearkes,2022-12-02,jscros i genuinely think he might be throwing the game,NEGATIVE,-1
3377,pearkes,George Pearkes,2022-12-02,serious question is lukaku getting paid off to throw this game,NEGATIVE,-1
3378,pearkes,George Pearkes,2022-12-02,rt dsquareddigest 😡 when you tell people their money is segregated and its not when you use one companys bank account and represent it…,NEGATIVE,-1
3379,pearkes,George Pearkes,2022-12-02,rt samswey police killed at least 1054 people through november 27 2022 police are killing people at higher rates in 2022 than any yea…,NEGATIVE,-1
3380,pearkes,George Pearkes,2022-12-02,eriz35 fake post fwiw,NEGATIVE,-1
3381,pearkes,George Pearkes,2022-12-02,conorsen it was optimistic as hell for me but i was a sophomore in college so like maybe a factor there,POSITIVE,1
3382,pearkes,George Pearkes,2022-12-02,el tri so close to advancing so far from the knockout round,NEGATIVE,-1
3383,pearkes,George Pearkes,2022-12-02,foreverwario absolutely tandled,POSITIVE,1
3384,pearkes,George Pearkes,2022-12-02,index of economic activity indicated by the relative frequency of constructive versus negative words in the beige book current economic backdrop weaker than any period between the gfc rebound and covid hitting and continues to slow httpstcoabs7er4ydb,NEGATIVE,-1
3385,pearkes,George Pearkes,2022-12-02,ball dont lie,POSITIVE,1
3386,pearkes,George Pearkes,2022-12-02,absolutely exasperating to watch this terrible httpstcoj8selyvm0q,NEGATIVE,-1
3387,pearkes,George Pearkes,2022-12-02,us through swiderski starting for polandgood 24 hours for clt fc supporters tbh,POSITIVE,1
3388,pearkes,George Pearkes,2022-12-02,eriz35 httpstcomlqydxkiz2,NEGATIVE,-1
3389,pearkes,George Pearkes,2022-12-02,rt neilsinhababu birdyword httpstcoihi7vewlts,NEGATIVE,-1
3390,pearkes,George Pearkes,2022-12-02,would be very curious what the decision making was behind this guest choice httpstcoyxfau43xeb,NEGATIVE,-1
3391,pearkes,George Pearkes,2022-12-02,mpaulmcnamara been watching the latter and its been good fun,POSITIVE,1
3392,pearkes,George Pearkes,2022-12-02,socceroos taking on denmark httpstcoyqd1o1udaw,NEGATIVE,-1
3393,pearkes,George Pearkes,2022-12-02,4th straight week of higher mortgage purchase apps level still almost 10 below where they were before the big drop at the end of september,NEGATIVE,-1
3394,pearkes,George Pearkes,2022-12-02,rt besttrousers dylanmatt do not let the boomers read this tweet,NEGATIVE,-1
3395,pearkes,George Pearkes,2022-12-02,rt evanhill alexi lalas wouldve rode a nuke into tehran like slim pickens in dr strangelove if the us lost that game,NEGATIVE,-1
3396,pearkes,George Pearkes,2022-12-02,httpstcouzo5j4ikzl,NEGATIVE,-1
3397,pearkes,George Pearkes,2022-12-02,therealhrdlicka usually but he had tons of space in front and perfect body position on the defenders,POSITIVE,1
3398,pearkes,George Pearkes,2022-12-02,man even i know you trap and shoot that heading itseriously,NEGATIVE,-1
3399,pearkes,George Pearkes,2022-12-02,davyera literally any finishing would be appreciated,NEGATIVE,-1
3400,pearkes,George Pearkes,2022-12-02,every minute we get these chances and dont actually bury one makes me more nervous,NEGATIVE,-1
3401,pearkes,George Pearkes,2022-12-02,not loving the vibes httpstcolkdnengen5,NEGATIVE,-1
3402,pearkes,George Pearkes,2022-12-02,eminflationista genuine question here how are they picking on elon musk,POSITIVE,1
3403,pearkes,George Pearkes,2022-12-02,“a little guy with a flute who steals stuff” is coincidentally the perfect description of how this man plays diplomacy httpstcocsz1xkam3b,POSITIVE,1
3404,pearkes,George Pearkes,2022-12-02,rt vebaccount glad to see the money bazooka shifting into physical investments a welcome change from it being pointed at a bunch of folk…,POSITIVE,1
3405,pearkes,George Pearkes,2022-12-02,seems like a good way to convince app store operators to keep twitter around httpstco3wgwlbfuxr,POSITIVE,1
3406,pearkes,George Pearkes,2022-12-02,rt buddyyakov nathantankus this is one of the funniest things i have seen httpstcofnuy89tiab,POSITIVE,1
3407,pearkes,George Pearkes,2022-12-02,bkmacd dude i haven’t but it’s going to get posted when i do i promise,POSITIVE,1
3408,pearkes,George Pearkes,2022-12-02,thegreymouser onepositivedude yeah i’ve run a plug in electric leaf blower out of them worked amazing,POSITIVE,1
3409,pearkes,George Pearkes,2022-12-02,contextproblem he is doesn’t have the poster’s disease that ganz does,POSITIVE,1
3410,pearkes,George Pearkes,2022-12-02,contextproblem oh yeah it went down hill to a hysterical literally degree my fav was the bench press rejoinder,NEGATIVE,-1
3411,pearkes,George Pearkes,2022-12-02,imgnrycanopnr correct but if we have mass ev adoption the financial incentive for charging networks to be roughly everywhere are enormous,NEGATIVE,-1
3412,pearkes,George Pearkes,2022-12-02,usermovie hassankhan bingo though i wish the f150 was tuned for more aggressive regen i’ve found the curve isn’t steep enough,NEGATIVE,-1
3413,pearkes,George Pearkes,2022-12-02,hassankhan i have a tire rotation scheduled for april other than that…¯ツ¯,NEGATIVE,-1
3414,pearkes,George Pearkes,2022-12-02,hassankhan radically more tire costs but almost everything else is zero,NEGATIVE,-1
3415,pearkes,George Pearkes,2022-12-02,contextproblem okay but hear me out ganz does need to calm down a bit he is very over the top online just red and mad and nude,NEGATIVE,-1
3416,pearkes,George Pearkes,2022-12-02,shorter williams httpstcow4xlga2szf,NEGATIVE,-1
3417,pearkes,George Pearkes,2022-12-02,charmanddecay the drive is also just amazingly quiet and smooth,POSITIVE,1
3418,pearkes,George Pearkes,2022-12-02,rt maxfisher so what does all that mean if chinas past experience is any lesson the likeliest outcome – tho hardly certain – is some…,NEGATIVE,-1
3419,pearkes,George Pearkes,2022-12-02,hurlman81 mikestraka2 interesting concept but i think theyd have to reengineer how the drive system works currently there are hard lockouts against driving while charging for obvious reasons,NEGATIVE,-1
3420,pearkes,George Pearkes,2022-12-02,illusivenick agtrader i was born and raised in british columbia nearest freeway was a three hour drive away but give it another shot maybe youll land something,NEGATIVE,-1
3421,pearkes,George Pearkes,2022-12-02,rt bespokeinvest the commentary is often colorful in the dallas fed manufacturing report but this months is something else httpstc…,NEGATIVE,-1
3422,pearkes,George Pearkes,2022-12-02,illusivenick agtrader i would simply drive where i need to rather than constructing baroque scenarios for something to go wrong in,NEGATIVE,-1
3423,pearkes,George Pearkes,2022-12-02,"emmonspired agtrader you want another one im trying to cross a market over here
httpstcohxafwmwdgs",NEGATIVE,-1
3424,pearkes,George Pearkes,2022-12-02,leedogtweets 👑👑👑,NEGATIVE,-1
3425,pearkes,George Pearkes,2022-12-02,hurlman81 mikestraka2 i havent towed yet but i will say the folks who do on the forum seem to have way better experiences than the bombthrowers on youtube,NEGATIVE,-1
3426,pearkes,George Pearkes,2022-12-02,"hurlman81 mikestraka2 what sort of towing applications are you looking at check out some forum posts before you write it off entirely

httpstcozjqsib7wgb
httpstco4kua57nr3t
httpstcodyiqyy7bv6
httpstcoe8vdmcp2u2
httpstcortwjbwg1hp
etc",NEGATIVE,-1
3427,pearkes,George Pearkes,2022-12-02,gawillstewart smithereen4now 2x4caster really annoying we dont get offpeak charging rates but then our electricity is so cheap it doesnt really matter,NEGATIVE,-1
3428,pearkes,George Pearkes,2022-12-02,agtrader im doing occasional runs to lowes not hauling eanasirs copper ingots crosscountry same as the vast majority of other truck drivers the need to haul a piece of heavy equipment across three states is typical suburban selfdelusion by people who use f250s as commuters lol,NEGATIVE,-1
3429,pearkes,George Pearkes,2022-12-02,irvingswisher posting a prop gun to prove youre in to guns is a hell of a thing,NEGATIVE,-1
