,username.1,name,day of publication,textclean,sentiment,helper
4845,pearkes,George Pearkes,2022-10-17,rt dakotajgordon pearkes the 3yearletterman origin story,NEGATIVE,-1
4846,pearkes,George Pearkes,2022-10-17,brrandin httpstco1zbdufkisq,NEGATIVE,-1
4847,pearkes,George Pearkes,2022-10-17,🫡🫡🫡🫡🫡🫡🫡🫡🫡🫡🫡🫡🫡 httpstcovcvcdnmh2w,NEGATIVE,-1
4848,pearkes,George Pearkes,2022-10-17,brrandin right,POSITIVE,1
4849,pearkes,George Pearkes,2022-10-17,scoring from your half off a qb draw on 2nd amp 24 sure why not 😈,NEGATIVE,-1
4850,pearkes,George Pearkes,2022-10-17,scottterriohma grapefruit and smoke go great together,POSITIVE,1
4851,pearkes,George Pearkes,2022-10-17,rt drewsav definitely think shes angling to be trumps running mate,POSITIVE,1
4852,pearkes,George Pearkes,2022-10-17,ashleyelisag haha tbf not a card installment plan for stuff in the gallery but yes,POSITIVE,1
4853,pearkes,George Pearkes,2022-10-17,bonecondor ole miss hasn’t lost at home in the better part of two years,POSITIVE,1
4854,pearkes,George Pearkes,2022-10-17,"rt samueltombs note that bailey is not endorsing markets current view that bank rate will rise to 55 

the mpc forecast in august t…",NEGATIVE,-1
4855,pearkes,George Pearkes,2022-10-17, httpstcowx7rikmthc,NEGATIVE,-1
4856,pearkes,George Pearkes,2022-10-17,claudiasahm httpstcoauvuxectnn,NEGATIVE,-1
4857,pearkes,George Pearkes,2022-10-17,claudiasahm an abstract black swan sculpture in an art gallery,POSITIVE,1
4858,pearkes,George Pearkes,2022-10-17,gilts the last two weeks httpstcogzsv0vifsi,NEGATIVE,-1
4859,pearkes,George Pearkes,2022-10-17,httpstcodprhlvxmv5,NEGATIVE,-1
4860,pearkes,George Pearkes,2022-10-17,pgoehaus33 also risk parity and ldi are…not conceptually the same,NEGATIVE,-1
4861,pearkes,George Pearkes,2022-10-17,jayoco is that guy taking enough blood pressure medication i worry about that sort of thing,NEGATIVE,-1
4862,pearkes,George Pearkes,2022-10-17,rt lucywwatson can’t get over this the health secretary is being prescribed courses of antibiotics only taking a bit of them then ha…,NEGATIVE,-1
4863,pearkes,George Pearkes,2022-10-17,rt modestproposal1 “there is often no one to kill” ☠️ httpstco5yvqmemaaa,NEGATIVE,-1
4864,pearkes,George Pearkes,2022-10-17,theemilyaccount she don’t miss,POSITIVE,1
4865,pearkes,George Pearkes,2022-10-17,rt felipedlh absolutely wild that in the span of two years using title 42 to weasel out of humanitarian obligations went from stephen mi…,NEGATIVE,-1
4866,pearkes,George Pearkes,2022-10-17,this feels like it was a good faith mistake but bostic c’mon man you’re operating in the public trust why play footsie with it just own an index for a few years httpstco4t3yfu4bil,NEGATIVE,-1
4867,pearkes,George Pearkes,2022-10-17,byyourlogic that’s right brother httpstcor99lujrhvt,NEGATIVE,-1
4868,pearkes,George Pearkes,2022-10-17,revhowardarson sample size of 144 nice,POSITIVE,1
4869,pearkes,George Pearkes,2022-10-17,jamiepastore9 wonder what their seed price would even be at this share count,NEGATIVE,-1
4870,pearkes,George Pearkes,2022-10-17,need a list of companies that successfully get to this very rare achievement httpstcouh336w51mj,POSITIVE,1
4871,pearkes,George Pearkes,2022-10-17,daguilarcanabal yeah seriously,POSITIVE,1
4872,pearkes,George Pearkes,2022-10-17,contextproblem revhowardarson right,POSITIVE,1
4873,pearkes,George Pearkes,2022-10-17,"contextproblem revhowardarson the premise is that liberals are willing to allow certain ideas to exist and be debated while the left is happy to say actually no some stuff is beyond the pale have a knuckle sandwich ymmv if this is true or not

both terms of convenience and brevity",NEGATIVE,-1
4874,pearkes,George Pearkes,2022-10-17,ntrickett16 zatapatique i know this is like just me but when someone is annexing their neighbors sending some arms around on favorable terms is not what id describe as commensurate let alone escalation,NEGATIVE,-1
4875,pearkes,George Pearkes,2022-10-17,zatapatique i am pushing back now,NEGATIVE,-1
4876,pearkes,George Pearkes,2022-10-17,have just been made aware this was an actual take a prominent historian unleashed earlier this year and bruh httpstcojaugcjhj7f,NEGATIVE,-1
4877,pearkes,George Pearkes,2022-10-17,"rt mcpli today friday is the voter registration deadline in 4 states

id
nc
ny
ok

sameday registration available on election day…",NEGATIVE,-1
4878,pearkes,George Pearkes,2022-10-17,"rt jordanschnyc thread the us governments new export controls are wreaking havoc on chinas chip industry 

new rules around us perso…",NEGATIVE,-1
4879,pearkes,George Pearkes,2022-10-14,rt bjudah briefly looking at things in a purely cynical way kwasi kwarteng possibly a rare case of a senior politician becoming chancel…,NEGATIVE,-1
4880,pearkes,George Pearkes,2022-10-14,"a senator from massachusetts is going to be very mad

kroger to buy albertsons for est consideration of 3410shr",NEGATIVE,-1
4881,pearkes,George Pearkes,2022-10-14,"were getting ready to restart buybacks and raising guidance but 
jpmorgan sees fairly significant headwinds for eco near future",NEGATIVE,-1
4882,pearkes,George Pearkes,2022-10-14,conorsen ,POSITIVE,1
4883,pearkes,George Pearkes,2022-10-14,jpmorgan sees fy nii excib markets 615b saw above 58b,NEGATIVE,-1
4884,pearkes,George Pearkes,2022-10-14,bdquinn right incremental normalization instead of a major credit cycle turn i think,NEGATIVE,-1
4885,pearkes,George Pearkes,2022-10-14,"us bancorp 3q net interest margin 283 est 276
us bancorp 3q provision for credit losses 362m est 3508m",NEGATIVE,-1
4886,pearkes,George Pearkes,2022-10-14,"jpmorgan 3q adj rev 3349b est 3235b
jpmorgan 3q provision for credit losses 154b est 122b
jpmorgan chase dimon hope to resume buybacks early next year",NEGATIVE,-1
4887,pearkes,George Pearkes,2022-10-14,"wells fargo 3q rev 1951b est 1881b
wells fargo 3q net interest margin 283 est 269
wells fargo 3q provision for credit losses 784m est 6108m",NEGATIVE,-1
4888,pearkes,George Pearkes,2022-10-14,httpstco4umqakan9t,NEGATIVE,-1
4889,pearkes,George Pearkes,2022-10-14,kenveksler ive assembled a collection of cheese graters guv lets have some fun,POSITIVE,1
4890,pearkes,George Pearkes,2022-10-14,"rt lazerdoov how to make thursday night football better

no punting allowed
3 points for a first down
the bears are actual bears
1 p…",NEGATIVE,-1
4891,pearkes,George Pearkes,2022-10-14,rt vamonosla america’s most based municipality,POSITIVE,1
4892,pearkes,George Pearkes,2022-10-14,sullybusiness tonight,NEGATIVE,-1
4893,pearkes,George Pearkes,2022-10-14,last callreminder httpstcofejpe4ob53,NEGATIVE,-1
4894,pearkes,George Pearkes,2022-10-14,teamcropdusters i meanlots of reporters are like this its kind of the job,POSITIVE,1
4895,pearkes,George Pearkes,2022-10-14,"rt maxseddon western military officials estimate ukraine could take kherson up to the dnipro as soon as next week

polinaivanovva h…",NEGATIVE,-1
4896,pearkes,George Pearkes,2022-10-14,fullcarry someone had a very bad morning right i mean,NEGATIVE,-1
4897,pearkes,George Pearkes,2022-10-14,rt clickhole wow season 3 of ted lasso is going to be incredible httpstcozftc9xrzwu,POSITIVE,1
4898,pearkes,George Pearkes,2022-10-14,sbarlowrob relatable,NEGATIVE,-1
4899,pearkes,George Pearkes,2022-10-14,quantian1 amusing you think you can escape the gravity of ohio,POSITIVE,1
4900,pearkes,George Pearkes,2022-10-14,rt mcklein bank of england httpstcosln8fg5ikw,NEGATIVE,-1
4901,pearkes,George Pearkes,2022-10-14,americans btfd in eurusd httpstcoxj74rtyi5e,NEGATIVE,-1
4902,pearkes,George Pearkes,2022-10-14,the thing that makes this even more ridiculous is that even fomc hawks are now saying regularly that inflation expectations are anchored bowman yday mester 1011 evans 927 bullard noted declining breakevens approvingly 927 and 929 httpstcoonsn9ailk0,NEGATIVE,-1
4903,pearkes,George Pearkes,2022-10-14,unsanechain i dont care what that guy thinks hes a scumbag misogynist and ive had him blocked for years,NEGATIVE,-1
4904,pearkes,George Pearkes,2022-10-14,samabell it was the bloomberg econ team submission not attributed by name maybe thestalwart could tell us who it is,NEGATIVE,-1
4905,pearkes,George Pearkes,2022-10-14,np12 lagrandenormie marcocastel guys a clown anyways the readthrough on a likeforlike category basis from yesterday to today was great httpstco4gmamk1e51,NEGATIVE,-1
4906,pearkes,George Pearkes,2022-10-14,creditjunk actually no ppi goods ex energy did a great job predicting cpi core goods the big issues were 1 rent 2 services which were actually softer than the ppi report significantly so httpstcoridhpuc1wb,NEGATIVE,-1
4907,pearkes,George Pearkes,2022-10-14,netcapgirl when will theemilyaccount allow us beep boops for spot price levels,NEGATIVE,-1
4908,pearkes,George Pearkes,2022-10-14,rt bespokeinvest this will be the fourth time 610 713 913 and today of the last five cpi days that the sampp 500 gapped down at lea…,NEGATIVE,-1
4909,pearkes,George Pearkes,2022-10-14,to clarify that bottom right one is durables ex auto,NEGATIVE,-1
4910,pearkes,George Pearkes,2022-10-14,talked about all of this on spaces but heres your cpi snapshot a grim one it is httpstcohzapl8ny5l,NEGATIVE,-1
4911,pearkes,George Pearkes,2022-10-14,44951 was the high 44677 current can someone pls tickle tuf for me so we get a nice round number situation,NEGATIVE,-1
4912,pearkes,George Pearkes,2022-10-14,itrismegistus who is that,NEGATIVE,-1
4913,pearkes,George Pearkes,2022-10-14,lumbertrading annualized,NEGATIVE,-1
4914,pearkes,George Pearkes,2022-10-14,ghead take out the 450 figure 2s,POSITIVE,1
4915,pearkes,George Pearkes,2022-10-14,httpstcoaltkyhi2ro,NEGATIVE,-1
4916,pearkes,George Pearkes,2022-10-14,jfexnine yeah for surveyors similar to home inspectors,NEGATIVE,-1
4917,pearkes,George Pearkes,2022-10-14,fast spot input costs began to decline preparing for a softer 2023 no broad pricing actions in q3 2022 prices in the market remained stable,NEGATIVE,-1
4918,pearkes,George Pearkes,2022-10-14,alexbhturnbull1 indeed,POSITIVE,1
4919,pearkes,George Pearkes,2022-10-14,woof httpstcob6sp7kj8hw,NEGATIVE,-1
4920,pearkes,George Pearkes,2022-10-14,105 minutes hence httpstcounlyq8rc7j,NEGATIVE,-1
4921,pearkes,George Pearkes,2022-10-14,the ldi situation is about as pure of a liquidity ltgt solvency situation as you can get almost the perfect problem for a central bank to solve and hes justdeciding not to its remarkable how bad the decision making is,NEGATIVE,-1
4922,pearkes,George Pearkes,2022-10-14,baileys decision this week to pull the plug on supporting gilts looks dramatically more irresponsible when you recall that the entire  situation is actually increasing solvency of pensions httpstcohrmcfqvem2,NEGATIVE,-1
4923,pearkes,George Pearkes,2022-10-14,ladyfohf approx 39 scaramuccis,NEGATIVE,-1
4924,pearkes,George Pearkes,2022-10-14,bullandbaird i mean do people really eat that much frozen pizza,NEGATIVE,-1
4925,pearkes,George Pearkes,2022-10-14,bullandbaird mike what the hell is going on here,NEGATIVE,-1
4926,pearkes,George Pearkes,2022-10-14,rt effmkthype lebasjanney httpstcoxn5mag2v8i,NEGATIVE,-1
4927,pearkes,George Pearkes,2022-10-14,cpi spaces tomorrow am w irvingswisher amp conorsen httpstcoaltkyi0c5w,NEGATIVE,-1
4928,pearkes,George Pearkes,2022-10-14,conorsen mattzeitlin enpancotti i agree that its kind of annoying people ruin perfectly good espresso by pouring water in it,NEGATIVE,-1
4929,pearkes,George Pearkes,2022-10-14,mattzeitlin i said this to enpancotti last night but ffs americanos exist and more people should drink them,NEGATIVE,-1
4930,pearkes,George Pearkes,2022-10-14,note the last class i took with mckenna his stuff was p good he did an extended monologue about how drunk he and his friends got at his combination 18th birthdaygraduation party in ireland httpstcoysvbpg7eyw,NEGATIVE,-1
4931,pearkes,George Pearkes,2022-10-14,"mr mckenna became distraught and fraught causing him to succumb to taking the vaccine

to succumb to taking the vaccine incredible scenes",NEGATIVE,-1
4932,pearkes,George Pearkes,2022-10-14,"if you can make it through four paragraphs of this suit against pton by an aggrieved former instructor without belly laughing i will give you one 1 high five next time we are in a class togther 
httpstcosngmilyzht httpstcobqsu3ornej",NEGATIVE,-1
4933,pearkes,George Pearkes,2022-10-14,teamcropdusters well some specific groups are in the usgood time to own natural gas prod but yes i know what you mean,NEGATIVE,-1
4934,pearkes,George Pearkes,2022-10-14,2x4caster not really because so far production isnt ramping upthe gas would have gotten consumed anyways so,NEGATIVE,-1
4935,pearkes,George Pearkes,2022-10-14,teamcropdusters tbf it hurts us a lot less,NEGATIVE,-1
4936,pearkes,George Pearkes,2022-10-14,the flip side of lng exports httpstcomxhoxd1rul,NEGATIVE,-1
4937,pearkes,George Pearkes,2022-10-14,mattlevine in this country first you get the money then you get the good tweets then you get the deal flow,POSITIVE,1
4938,pearkes,George Pearkes,2022-10-14,rt mattlevine everyone has money everyone has some story about how they can introduce you to customers and service providers or whateve…,NEGATIVE,-1
4939,pearkes,George Pearkes,2022-10-14,markdow i really hope that because he knows less about soccer he just gets out of the way and lets his team run the portfolio,NEGATIVE,-1
4940,pearkes,George Pearkes,2022-10-14,"good column tepper is running stops too tight and has botched some trades hopefully he starts to find some winners and let them run because this churn is brutal
httpstcob0vfiyv3p3",NEGATIVE,-1
4941,pearkes,George Pearkes,2022-10-14,horatioalgorthm driving my lifted raptor on my daily commute from caddo mills to ft worth ive been on i30 for 90 minutes and still havent passed the bass pro shops on lake ray hubbard ill get to work at noon leave at 3 to avoid the traffic cant wait for an 8pm chicken fried steak at hom,NEGATIVE,-1
4942,pearkes,George Pearkes,2022-10-14,rt cartersherman a florida planned parenthood recently saw a quite young adolescent patient who was pregnant due to incest per a pres…,NEGATIVE,-1
4943,pearkes,George Pearkes,2022-10-14,rt nathantankus central bankers have financial stability mandates not heads of governments stabilizing the government securities market…,POSITIVE,1
4944,pearkes,George Pearkes,2022-10-14,econderek oh for sure i didnt mean nobody caught it but a lot didnt,NEGATIVE,-1
4945,pearkes,George Pearkes,2022-10-14,roryjohnston yeah i actually think this is a good implementation the design is pretty creative,POSITIVE,1
4946,pearkes,George Pearkes,2022-10-14,it really was wild how big arm activity was in the 2000s and what an incredible red flag it should have been also hello edits httpstcouvnkk1lulv httpstcogfq1wgz1vb,POSITIVE,1
4947,pearkes,George Pearkes,2022-10-14,skelecap tomashirstecon cant be dependent on chinese supply if you dont build any renewables httpstcogmvsjqf1p2,NEGATIVE,-1
4948,pearkes,George Pearkes,2022-10-14,alexbhturnbull1 bradsetser thestalwart it’s funny watching domestic us political economy around some of this stuff extractive economy preference versus own the libs preference httpstcolrbnpcpqe3,POSITIVE,1
4949,pearkes,George Pearkes,2022-10-14,williamxnote prackapital thestalwart “where are our retirement savings” httpstcoxolhw6jjza,NEGATIVE,-1
4950,pearkes,George Pearkes,2022-10-14,tomashirstecon telling on themselves,POSITIVE,1
4951,pearkes,George Pearkes,2022-10-14,"thestalwart yes
httpstco4lyh7vcn5g httpstco5jenpjrycy",NEGATIVE,-1
4952,pearkes,George Pearkes,2022-10-14,marcocastel i am allowed to pick and choose the things that fit my narrative in the menchies but anyone else pointing out anything i disagree with is cherry picking grow up my guy lol,NEGATIVE,-1
4953,pearkes,George Pearkes,2022-10-14,this sentence definitely makes sense if youve never heard of the landmark industrial policy bill that passed this summer designed to turbocharge battery supply chain diversification away from china otherwise its just blatantly silly imo httpstcoq6qt8p8p4t,NEGATIVE,-1
4954,pearkes,George Pearkes,2022-10-14,rt edsbs eric andre is right  httpstcoihg1gcvsoj,NEGATIVE,-1
4955,pearkes,George Pearkes,2022-10-14,newriverinvest at this point i am very skeptical they dont lose area relative to pre2022,POSITIVE,1
4956,pearkes,George Pearkes,2022-10-14,marcocastel good news is not good news because i can also find bad news i am very smart,NEGATIVE,-1
4957,pearkes,George Pearkes,2022-10-14,conorsen 2019 cuts had a material impact on growth,POSITIVE,1
4958,pearkes,George Pearkes,2022-10-14,good news httpstcoqd9n7fx0dn,POSITIVE,1
4959,pearkes,George Pearkes,2022-10-14,2x4caster dustin idk what to tell you this is what they want,POSITIVE,1
4960,pearkes,George Pearkes,2022-10-14,itrismegistus the incremental origination was something like 40bnquarter call it a 150bn total drop in the bucket compared to income expansiondebt extinguishmentcash balance increase in aggregate httpstcovm7qk7wjua,NEGATIVE,-1
4961,pearkes,George Pearkes,2022-10-14,new lows for purchase apps httpstcohhyrakl1kk,NEGATIVE,-1
4962,pearkes,George Pearkes,2022-10-14,"rt swannmarcus89 when the fed lowers interest rates the fed is causing income inequality by driving up asset values

when the fed rais…",NEGATIVE,-1
4963,pearkes,George Pearkes,2022-10-14,foreverwario httpstcoze5bsxl1pj,NEGATIVE,-1
4964,pearkes,George Pearkes,2022-10-14,byyourlogic oh it’s incredible if you were going to confuse one song with a corpus it would be that one,POSITIVE,1
4965,pearkes,George Pearkes,2022-10-14,byyourlogic the cool people were the ones doing the same claim but for spanish language rap and just listening to gasolina 47 times a day,NEGATIVE,-1
4966,pearkes,George Pearkes,2022-10-14,thefrugalbanker dude wwwhhhhhat,NEGATIVE,-1
4967,pearkes,George Pearkes,2022-10-14,enpancotti 🫡🫡🫡 httpstcoeahdqmtg7a,NEGATIVE,-1
4968,pearkes,George Pearkes,2022-10-14,enpancotti this is a travesty they’re great easy to make versatile just an all around spectacular libation you know what i’m going to make one right now,POSITIVE,1
4969,pearkes,George Pearkes,2022-10-14,httpstcoyc7w7bhece,NEGATIVE,-1
4970,pearkes,George Pearkes,2022-10-14,enpancotti also where is the venerable americano in this discourse you get all the bitter and bubbles with none of the hangover,POSITIVE,1
4971,pearkes,George Pearkes,2022-10-14,crossdefault yeah it was a whole disaster par for the course,NEGATIVE,-1
4972,pearkes,George Pearkes,2022-10-14,kylef austin the truck,POSITIVE,1
4973,pearkes,George Pearkes,2022-10-11,rt tomashirstecon starting a campaign to replace senior uk public sector employees with a set of colourful rocks on a caretaker basis,NEGATIVE,-1
4974,pearkes,George Pearkes,2022-10-11,rienzokennedy 3pointtrader volmagorov why theyre yummy,NEGATIVE,-1
4975,pearkes,George Pearkes,2022-10-11,boes bailey says we will be out by the end of the week httpstcozneqkaeuwv,NEGATIVE,-1
4976,pearkes,George Pearkes,2022-10-11,mcklein thestalwart josephpolitano what are those implicit and explicit subsidies out of curiosity,NEGATIVE,-1
4977,pearkes,George Pearkes,2022-10-11,madmanx89 thestalwart josephpolitano simple solution just ban street parking then theres no circling,NEGATIVE,-1
4978,pearkes,George Pearkes,2022-10-11,thestalwart josephpolitano but what if high parking costs just reflect the fully internalized cost of driving in manhattan offsetting the sundry other implicit and explicit subsidies which create  enormous externalities,NEGATIVE,-1
4979,pearkes,George Pearkes,2022-10-11,rt jonlemire cape canaveral fla ap — nasa says spacecraft crash changed an asteroids orbit in test to protect earth from future thre…,NEGATIVE,-1
4980,pearkes,George Pearkes,2022-10-11,3pointtrader volmagorov caaaancelled,NEGATIVE,-1
4981,pearkes,George Pearkes,2022-10-11,dandolfa duration is part of it,POSITIVE,1
4982,pearkes,George Pearkes,2022-10-11,conorsen i was mulling it in my head and there are so many puts and takes that its hard to falsify that said people still love getting worked up over stuff like this,NEGATIVE,-1
4983,pearkes,George Pearkes,2022-10-11,conorsen this ones going to get some spicy replies i agree w u btw,POSITIVE,1
4984,pearkes,George Pearkes,2022-10-11,narrativemachi1 she didn’t say anything she didn’t say last week anyways,NEGATIVE,-1
4985,pearkes,George Pearkes,2022-10-11,crbarrineau yes  the only mixing necessary for a lot of stuff is citrus  everything else,NEGATIVE,-1
4986,pearkes,George Pearkes,2022-10-11,mts likes to do all sorts of highly personal attacks against my favored pastimes and preferences specifically he is a menace httpstcoiwt3xwv6rb,NEGATIVE,-1
4987,pearkes,George Pearkes,2022-10-11,rt noamscheiber news biden admin releases longanticipated rule making it more likely for millions of workers to be classified as employ…,NEGATIVE,-1
4988,pearkes,George Pearkes,2022-10-11,lumbertrading both can be true,POSITIVE,1
4989,pearkes,George Pearkes,2022-10-11,volmagorov i think there are a few here that could escape some people rice cakes jerky vegetarians exist that sort of thing but yeah everyone should be tagging 40 wo much effort,NEGATIVE,-1
4990,pearkes,George Pearkes,2022-10-11,conorsen pcdunham both dude,NEGATIVE,-1
4991,pearkes,George Pearkes,2022-10-11,rt javierblas us president joe biden believes america needs to reevaluate saudi relationship says white house spokesman john kirby  o…,NEGATIVE,-1
4992,pearkes,George Pearkes,2022-10-11,cien por ciento disappointingly easy httpstco9pww694edg,NEGATIVE,-1
4993,pearkes,George Pearkes,2022-10-11,bkmacd 34bps foolallthetime mayfaircynic midweek dadcore httpstcoc7rboyheop,NEGATIVE,-1
4994,pearkes,George Pearkes,2022-10-11,yngvlgrn jfc thats depressing,NEGATIVE,-1
4995,pearkes,George Pearkes,2022-10-11,rt skelecap allo uk je suis guy incognito from alábame in les etats units et je have a biznes pitch for you a great american store wher…,NEGATIVE,-1
4996,pearkes,George Pearkes,2022-10-11,parziplace yeah we had a great start soooo close to playoffs as an expansion team is nothing to be sad about,POSITIVE,1
4997,pearkes,George Pearkes,2022-10-11,conorsen anti,NEGATIVE,-1
4998,pearkes,George Pearkes,2022-10-11,i am antihalloween inflatables with one critical exception httpstcom4i613k0vz,NEGATIVE,-1
4999,pearkes,George Pearkes,2022-10-11,reuppingdm me if youre interested in joining subjects of conversation will be the panthers terrible clt fc not a bad first season tepper sports amp entertainment chaos monkeys cpi numbers due thursday am and all other necessary commiseration httpstcofejpe4ob53,NEGATIVE,-1
5000,pearkes,George Pearkes,2022-10-11,rt byzantineprof was the byzantine empire really just the roman empire in a word yes in this thread i explore some arguments for and…,POSITIVE,1
5001,pearkes,George Pearkes,2022-10-11,rt brooklynspoke your kids are not at danger of getting rainbow fentanyl on halloween its a razor blades in apples panic made up by f…,NEGATIVE,-1
5002,pearkes,George Pearkes,2022-10-11,preachypreach duncanweldon tobyn no that goes straight in the bin,NEGATIVE,-1
5003,pearkes,George Pearkes,2022-10-11,rt jonahfurman wow the bmwe the thirdlargest rail union has rejected the railroad companies tentative agreement by 56 and set an ea…,NEGATIVE,-1
5004,pearkes,George Pearkes,2022-10-11,fedspeak conorsen ruthlessgravity i never bet substantially against bill on housing but to each their own httpstcoxf0coxjmru,NEGATIVE,-1
5005,pearkes,George Pearkes,2022-10-11,conorsen ruthlessgravity sure but prices right now aren’t really sustainable at a 5 30y national average imo,NEGATIVE,-1
5006,pearkes,George Pearkes,2022-10-11,conorsen ruthlessgravity i think the calculated risk take is right long slow grind down in home prices from here,NEGATIVE,-1
5007,pearkes,George Pearkes,2022-10-11,mihirpshah conorsen i had friends buying in atlanta and raleigh before 25,POSITIVE,1
5008,pearkes,George Pearkes,2022-10-11,conorsen maybe there are lots of people who did though,POSITIVE,1
5009,pearkes,George Pearkes,2022-10-11,tangentstyle yeah idk man it like literally doesnt matter the feds solvency and profitability are all just made up entries theyre not even really philosophically interesting imo and theyre definitely not relevant to monetary policy,NEGATIVE,-1
5010,pearkes,George Pearkes,2022-10-11,rt okwildlifedept be diligent and check your childs candy this year just found an invasive silver carp shoved inside a milky way no wo…,NEGATIVE,-1
5011,pearkes,George Pearkes,2022-10-11,conorsen i feel like i did pretty good as an 89er tbh,POSITIVE,1
5012,pearkes,George Pearkes,2022-10-11,shotchaser httpstcoxds8c6qh34,NEGATIVE,-1
5013,pearkes,George Pearkes,2022-10-11,tangentstyle who is sweating the negative carry position,NEGATIVE,-1
5014,pearkes,George Pearkes,2022-10-11,"näher und näher

germany backs joint eu debt for loans to tackle energy crisis",NEGATIVE,-1
5015,pearkes,George Pearkes,2022-10-11,34bps market has already seized on like three different false alarms for a pivot since july so we kinda know lol,NEGATIVE,-1
5016,pearkes,George Pearkes,2022-10-11,chriswhittall tobyn its also frustrating to see ccps generally presented as cash only when its a regulatory approach rather than one inherent to the ccp model,NEGATIVE,-1
5017,pearkes,George Pearkes,2022-10-11,chriswhittall tobyn again think there are lessons to be learned from this little episode and it revealed that the design of a ccp system is shorting liquidity risk rather than credit risk but you can mitigate that many ways ex ante and ex post to generate a much better outcome than bilateral,NEGATIVE,-1
