,username.1,name,day of publication,textclean,sentiment,helper
1700,mark_dow,Dow,2022-09-28,buy or sell httpstco890pc08mxz,NEGATIVE,-1
1701,mark_dow,Dow,2022-09-28,mikealfred bonds have two types of risk credit and interest rate duration when people say treasuries are riskfree they’re only referring to the credit part this can lead to people getting confused but i think most ppl get that treasuries have interest rate risk,NEGATIVE,-1
1702,mark_dow,Dow,2022-09-28,your honor my client invokes the jersey defense httpstcoju8b1n1hqr,POSITIVE,1
1703,mark_dow,Dow,2022-09-28,rt stockmktnewz qqq is getting closer and closer to those june lows 👀,NEGATIVE,-1
1704,mark_dow,Dow,2022-09-28,carlquintanilla cnbc peterschack too close to home,NEGATIVE,-1
1705,mark_dow,Dow,2022-09-28,irvingswisher econderek claudiasahm conorsen ivanthek cullenroche gregip jeannasmialek nicktimiraos noahpinion vtg2 steveliesman absolutely just saying its hard to compare across cycles a change in fci wo also comparing initial conditions also true that a given change in an fci matters more before financial derisking starts than after it has been underway for a good while,NEGATIVE,-1
1706,mark_dow,Dow,2022-09-28,it was powell in the boardroom with the rate hike httpstcogfrdz6fs2o,NEGATIVE,-1
1707,mark_dow,Dow,2022-09-28,ltlookgt httpstcoo2mahrvxzs,NEGATIVE,-1
1708,mark_dow,Dow,2022-09-28,rt dtcochrane sadly the bezzle will continue to syphon money from middle income dupes to high income frauds for a while i think https…,NEGATIVE,-1
1709,mark_dow,Dow,2022-09-28,macrosizzle behavioralmacro,NEGATIVE,-1
1710,mark_dow,Dow,2022-09-28,econderek claudiasahm conorsen ivanthek cullenroche gregip irvingswisher jeannasmialek nicktimiraos noahpinion vtg2 steveliesman sure i take your point i was just pointing out the difficulty of comparing that with say one half that in totally different initial conditions,NEGATIVE,-1
1711,mark_dow,Dow,2022-09-28,i love the smell of currency intervention in the morning nothing else in the world smells like that  colonel kanda,POSITIVE,1
1712,mark_dow,Dow,2022-09-28,boj is going to try and squeeze the positioning which is heavily skewed rn to one side of the boat too juicy a target not to usdjpy,NEGATIVE,-1
1713,mark_dow,Dow,2022-09-28,econderek claudiasahm conorsen ivanthek cullenroche gregip irvingswisher jeannasmialek nicktimiraos noahpinion vtg2 steveliesman think about it this way which matters more for future growth a change in fci when you have weak balance sheets or a change in fci when you have strong balance sheets not easy to calibrate that difference but matters hugely in behavioral terms,POSITIVE,1
1714,mark_dow,Dow,2022-09-28,bryan21896 gladstein haha 70k to 18k and counting looks like a pretty big l to me httpstcoz2gsn9v55j,NEGATIVE,-1
1715,mark_dow,Dow,2022-09-28,econderek claudiasahm conorsen ivanthek cullenroche gregip irvingswisher jeannasmialek nicktimiraos noahpinion vtg2 steveliesman initial conditions matter as much if not more than the delta in financial conditions private sector balance sheets started out in a very strong place and financial market systemic risk is in a much better place makes it hard to do applestoapples with previous fci tightenings,NEGATIVE,-1
1716,mark_dow,Dow,2022-09-28,rt econderek thanks as always to jasonfurman for being so thoughtful and thoughtprovoking  heres brief exchange regarding financialc…,POSITIVE,1
1717,mark_dow,Dow,2022-09-22,key to the feds current messaging imo httpstcoonu26nsru5,NEGATIVE,-1
1718,mark_dow,Dow,2022-09-22,howardlindzon httpstco4t07kpl2hb,NEGATIVE,-1
1719,mark_dow,Dow,2022-09-22,econderek tboehmcrypto ahahaha,NEGATIVE,-1
1720,mark_dow,Dow,2022-09-22,howardlindzon 359am,NEGATIVE,-1
1721,mark_dow,Dow,2022-09-22,gladstein billions,POSITIVE,1
1722,mark_dow,Dow,2022-09-22,"bitcoinissaving it can be a dying asset and go up in price
httpstcoctc47pelby",NEGATIVE,-1
1723,mark_dow,Dow,2022-09-22,gettxoutsetinfo mightychartist there’s also a provably scarce supply of people who haven’t lost money in it—the opposite of what the hype men promised,NEGATIVE,-1
1724,mark_dow,Dow,2022-09-22,viannadp we didn’t know amazons value immediately but we recognized many of its popular use cases immediately,POSITIVE,1
1725,mark_dow,Dow,2022-09-22,buckfoomers mightychartist the three people in zimbabwe who have computers could theoretically move money out of the country without going through dollars or something,NEGATIVE,-1
1726,mark_dow,Dow,2022-09-22,gik httpstcouemo7tsjky,NEGATIVE,-1
1727,mark_dow,Dow,2022-09-22,julianmmarshall mightychartist not everyone is as paranoid as you are that’s the bottom line not enough paranoid people willing to get through the hassle the friction the cost and then take hugely volatile price risk just to avoid central bank fiat,NEGATIVE,-1
1728,mark_dow,Dow,2022-09-22,mightychartist show me a use case that wld make regular peoples lives easier cheaper whatever and you can convince me 12 years in and i haven’t seen anything except gambling numbergoup hope hypemen pimping and paranoid and uninformed central bank narratives,NEGATIVE,-1
1729,mark_dow,Dow,2022-09-22,superbitcoinbro mightychartist fidelity and blackrock had to have started this process over a year ago which given the environment might have made more sense but with the bulk of the costs already sunk the marginal cost of going ahead now anyway and rolling it out is basically zero,NEGATIVE,-1
1730,mark_dow,Dow,2022-09-22,mightychartist the risk cycle needed to end for bitcoin to be seen for what it is like spacs bad ipos crypto and nfts it was the product of a greed cycle sure there are still a lot of hype men  and institutions with an interest in propping it up but the pool of greater fools is shrinking,NEGATIVE,-1
1731,mark_dow,Dow,2022-09-22,superbitcoinbro mightychartist bitcoin’s not helping any country as we’ve seen in el salvador taxes aren’t denominated in bitcoin they’re denominated in dollars and the big institutions started the process a long time ago when interest was higher no cost of them at this point but they’re not investing,NEGATIVE,-1
1732,mark_dow,Dow,2022-09-22,rt markdow mightychartist 12 years no use case and constantly morphing promises of future utility that’s what we call a busted invest…,NEGATIVE,-1
1733,mark_dow,Dow,2022-09-22,riverdaleboy nice,POSITIVE,1
1734,mark_dow,Dow,2022-09-22,mightychartist 12 years no use case and constantly morphing promises of future utility that’s what we call a busted investment thesis people clinging to fading hopes of the huge riches and financial independence they thought bitcoin promised that’s all that’s left,NEGATIVE,-1
1735,mark_dow,Dow,2022-09-22,there’s still so many guys out there clinging to any semi plausible hope that bitcoin is not a failed experiment by now that it could still be a thing that a popular use case is just around the corner and that no coiners “just don’t understand“ it’s over,NEGATIVE,-1
1736,mark_dow,Dow,2022-09-22,yield farming but for fiat,NEGATIVE,-1
1737,mark_dow,Dow,2022-09-22,i dont care still blaming the imf httpstcoteadiactzi,NEGATIVE,-1
1738,mark_dow,Dow,2022-09-22,buy or sell httpstcovixywqszsd,NEGATIVE,-1
1739,mark_dow,Dow,2022-09-22,misterjrt httpstcoexvn4xp4a8,NEGATIVE,-1
1740,mark_dow,Dow,2022-09-22,howardlindzon i feel like you’re setting up a dao joke,NEGATIVE,-1
1741,mark_dow,Dow,2022-09-22,howardlindzon httpstco1q6dqiojfo,NEGATIVE,-1
1742,mark_dow,Dow,2022-09-22,“youve fallen for one of the two classic blunders the first being never get involved in a currency war in asia but only slightly lesser known never go in against the fed when debt is on the line” httpstcov6nbtmhoxs,NEGATIVE,-1
1743,mark_dow,Dow,2022-09-22,mightychartist blights on humanity both,POSITIVE,1
1744,mark_dow,Dow,2022-09-22,please dont make me buy gold,NEGATIVE,-1
1745,mark_dow,Dow,2022-09-22,long and variable questions,NEGATIVE,-1
1746,mark_dow,Dow,2022-09-22,powell when he gets back to his office after the presser and sees his screens httpstcoimoqvwghze,NEGATIVE,-1
1747,mark_dow,Dow,2022-09-22,mikealfred for sure this is why the insider trading allegations wrt the fed were so lame,NEGATIVE,-1
1748,mark_dow,Dow,2022-09-22,hmeisler wont pass the smell test,POSITIVE,1
1749,mark_dow,Dow,2022-09-22,hmeisler you and i are 100 from the same school in this regard for sure,POSITIVE,1
1750,mark_dow,Dow,2022-09-22,everyone talking about how hawkish the fed is if the market closes green reasons why ackshually the fed was dovish will instantaneously materialize,POSITIVE,1
1751,mark_dow,Dow,2022-09-22,call us when the presser starts httpstcojvg4j3qisa,NEGATIVE,-1
1752,mark_dow,Dow,2022-09-22,loler for longer,NEGATIVE,-1
1753,mark_dow,Dow,2022-09-22,4 minutes httpstcogrkv3c1pk6,NEGATIVE,-1
1754,mark_dow,Dow,2022-09-22,rt espiers trump’s fraud has been out there for a long time he got away with it for years not because people didn’t know about it or the…,NEGATIVE,-1
1755,mark_dow,Dow,2022-09-22,early release of todays dot plot httpstcotmsmdqqkqf,NEGATIVE,-1
1756,mark_dow,Dow,2022-09-22,dillyri but the thread does underscore how the fed raising rates hasnt for a long time meant draining liquidity from the system systemic liquidity,NEGATIVE,-1
1757,mark_dow,Dow,2022-09-22,dillyri it doesnt tho swap lines make the financial world in some sense more us centric but that doesnt mean a priori appreciation or depreciation really depends on those other factors i cited,NEGATIVE,-1
1758,mark_dow,Dow,2022-09-22,rt tdgraff live look at the dot plot httpstcoisokvsocgj,NEGATIVE,-1
1759,mark_dow,Dow,2022-09-22,dillyri also ftr the fed raising rates doesnt suck liquidity out of the system if you havent seen already read the thread on fed plumbing i rted earlier today,NEGATIVE,-1
1760,mark_dow,Dow,2022-09-22,dillyri it may have morphed into that when the original thesis didnt play out idk but i remember it starting out as being about all the issuance of 10t usd denom debt in em and when that blew up there would be a scramble for usd that wld crush the world raoul pal was on this too,NEGATIVE,-1
1761,mark_dow,Dow,2022-09-22,feels like ppl think powell is likely to lean hawkish,NEGATIVE,-1
1762,mark_dow,Dow,2022-09-22,keysersozebro1 dillyri seems like you’re conflating your market call with underlying languages i’m just talking about underlying linkages i am not making a market call on the dollar one way or the other that’s a separate issue,NEGATIVE,-1
1763,mark_dow,Dow,2022-09-22,dillyri the two factors that drive the dollar tend to be one changes in the interest rate differentials particularly persistent ones and two more importantly whether people are moving out or moving in on the risk spectrum ayktk you don’t need any contrived catastrophist theory,NEGATIVE,-1
1764,mark_dow,Dow,2022-09-22,keysersozebro1 dillyri but that’s not happening for one us equities are going down and two as i understand it that’s not the theory anyway the answer is much more simple global funds are dollar denominated and are going back to their base currency and us interest rates are going higher,NEGATIVE,-1
1765,mark_dow,Dow,2022-09-22,dillyri why would negative real rates in the us all else equal the reason for dollar strength,NEGATIVE,-1
1766,mark_dow,Dow,2022-09-22,dillyri global debt will lead to a global credit collapse driving demand for usd to pay debts which prob wouldnt happen anyway bc defaults definitely didnt happen and certainly has been driving usd higher looks like a case of right for wrong reason,NEGATIVE,-1
1767,mark_dow,Dow,2022-09-22,dillyri no if anything thatd take pressure off usd demand but thats not really an issue anyway its that the global investment universe is primarily usd denominated when ppl reduce risk they also reduce ccy risk producing usd demand every cycle since forever but the whole,NEGATIVE,-1
1768,mark_dow,Dow,2022-09-22,narrativemachi1 keysersozebro1 dillyri seems like it yeah,POSITIVE,1
1769,mark_dow,Dow,2022-09-22,airswimmingape much of bitcoins following was built on a terrible understanding of and often paranoia about central banking,NEGATIVE,-1
1770,mark_dow,Dow,2022-09-22,keysersozebro1 dillyri i thought it was usd demand from global credit crisis and we dont have that what we have is standard usd strength from generic risk off plus policy rate differentials,NEGATIVE,-1
1771,mark_dow,Dow,2022-09-22,dillyri from what i gather that theory is bear porn bullshit credit spreads wld be blowing out if that were the reason for usd strength usd is strong bc usd is the denominator for global investment and were in risk reduction phase  interest rate differential not global credit crisis,NEGATIVE,-1
1772,mark_dow,Dow,2022-09-22,riverdaleboy and they should read it over and over until they do,NEGATIVE,-1
1773,mark_dow,Dow,2022-09-22,airswimmingape no need for a detailed note investment thesis keeps morphingalways a bad signand serial promises of killer apppopular use case just around the corner keep not materializing plus built on hypemencomically flawed understanding of central banking its been over a decade,NEGATIVE,-1
1774,mark_dow,Dow,2022-09-22,spx is up 39 ytd in bitcoin terms,NEGATIVE,-1
1775,mark_dow,Dow,2022-09-22,i for one want to read too much into the markets one day reaction to todays fed statement and presser,NEGATIVE,-1
1776,mark_dow,Dow,2022-09-22,rt isaacstanbecker trumps pac which raises money by promising donors theyre defending the former presidents legacy is still paying m…,NEGATIVE,-1
1777,mark_dow,Dow,2022-09-22,really,POSITIVE,1
1778,mark_dow,Dow,2022-09-22,katiemartinfx saylor surprisingly quick,POSITIVE,1
1779,mark_dow,Dow,2022-09-22,snippetfinance he knows his stuff endorse,POSITIVE,1
1780,mark_dow,Dow,2022-09-22,saylor httpstcoxk99ddvnnm,NEGATIVE,-1
1781,mark_dow,Dow,2022-09-22,well informed thread on the fed plumbing and how its evolved if you ready want to understand how things actually work and get an edge you should read httpstcowajncmu3sa,POSITIVE,1
1782,mark_dow,Dow,2022-09-22,rt ivanthek this seems like a bigger deal than the scant attention its getting,NEGATIVE,-1
1783,mark_dow,Dow,2022-09-22,ivanthek idk heard he dyed,NEGATIVE,-1
1784,mark_dow,Dow,2022-09-22,jamesd45 normalhumanfun ackmanforever mattgaetz ya boy is next sparky httpstcota0f2hfbco,NEGATIVE,-1
1785,mark_dow,Dow,2022-09-22,rt laurenthehough lol you dumbfucks sent them to lawyer island the fuck did you think was gonna happen,NEGATIVE,-1
1786,mark_dow,Dow,2022-09-22,"bitcoin loves corporate wall st and hangs on the federal reserve’s every twitch 

vive la révolution httpstcohnskk3uzbq",POSITIVE,1
1787,mark_dow,Dow,2022-09-22,europe cant do this and this is a monstrous problem for them httpstco0k1edh8lyy,NEGATIVE,-1
1788,mark_dow,Dow,2022-09-22,hey jimcramer can you grill tell a little on why they havent been able to close on financing for so long now,POSITIVE,1
1789,mark_dow,Dow,2022-09-22,fjcruiserdxb zero or i would disclose it,NEGATIVE,-1
1790,mark_dow,Dow,2022-09-22,i’m no esg guy but i want to boost this for a friend httpstcolfutvrvezw,POSITIVE,1
1791,mark_dow,Dow,2022-09-22,"rt tier10k mstr

symbol btcusd
size 130000
entry price 30639
mark price 19083

pnl 1500616000 httpstcopjvhhfv2yo",NEGATIVE,-1
1792,mark_dow,Dow,2022-09-22,rt vincemancini kirk cousins’ full name is actually “kirkland signature cousins”,POSITIVE,1
1793,mark_dow,Dow,2022-09-22,rhinotarian httpstco3ne3fk444q,NEGATIVE,-1
1794,mark_dow,Dow,2022-09-22,abbott and costoletto whos on the docket first httpstcot6wj7ogp7e,NEGATIVE,-1
1795,mark_dow,Dow,2022-09-22,rt greenzenforest markdow httpstco5vgh6azajs,NEGATIVE,-1
1796,mark_dow,Dow,2022-09-22,greenzenforest ahahahaha,POSITIVE,1
1797,mark_dow,Dow,2022-09-22,not good httpstcokxo0czhy5r,NEGATIVE,-1
1798,mark_dow,Dow,2022-09-22,tbh it’s an open question httpstconpe4o5iylm,NEGATIVE,-1
1799,mark_dow,Dow,2022-09-22,rt highyieldharry opendoor is only down 83 since this tweet,NEGATIVE,-1
1800,mark_dow,Dow,2022-09-22,normal tourist visit httpstcopzzdvoqdhb,NEGATIVE,-1
1801,mark_dow,Dow,2022-09-22,rt thestalwart another reminder that in addition to the fed a major fiscal tightening is underway httpstcobyusfarhie,NEGATIVE,-1
1802,mark_dow,Dow,2022-09-22,httpstcoqooh26vyka httpstcojp5vnjrypn,NEGATIVE,-1
1803,mark_dow,Dow,2022-09-22,rt nativesantacruz look at these clouds httpstcok033xxjjjb,NEGATIVE,-1
1804,mark_dow,Dow,2022-09-22,rt ejeurope wondering what the italian elections will mean for europe join us online on 28 september at 1830 cest for an expert panel…,NEGATIVE,-1
1805,mark_dow,Dow,2022-09-22,claro po httpstcolxrdrxwxlv,NEGATIVE,-1
1806,mark_dow,Dow,2022-09-22,sirripsters fullcarry get shorty used to be the forward guidance,NEGATIVE,-1
1807,mark_dow,Dow,2022-09-22,the market is at the point of no returns,NEGATIVE,-1
1808,mark_dow,Dow,2022-09-22,sidverma the presidency is our system but your problem,NEGATIVE,-1
1809,mark_dow,Dow,2022-09-22,hooperquant something something liquidity,POSITIVE,1
1810,mark_dow,Dow,2022-09-22,hooperquant hammer finds nail,POSITIVE,1
1811,mark_dow,Dow,2022-09-22,breaking homebuilder stocks soar on the back of terrible national association of home builders index print,NEGATIVE,-1
1812,mark_dow,Dow,2022-09-22,aridavidpaul the whole smart vs dumb is wrong tho there is no smart money in the advanced stages of a bubble everyone wants in sometimes the smartest sucker the hardest again just look at bitcoincryptonfts 12 months ago but you could literally pick any asset bubble to make same pt,NEGATIVE,-1
1813,mark_dow,Dow,2022-09-22,"aridavidpaul intuition is more financialized  more ppl more viewpoints and the smart viewpoints win more efficient

reality is more financialized  more ppl more herd behavioral and crowd mentality wilder moves less efficient

see it a million times most recently in cryptobitcoin",NEGATIVE,-1
1814,mark_dow,Dow,2022-09-22,aridavidpaul my 25 years in markets have taught me the opposite the more financialized a market ceteris paribus the less efficient more prone to bandwagoning overundershooting trend following risk chasing and other cognitive biases it tend to be,NEGATIVE,-1
1815,mark_dow,Dow,2022-09-22,aridavidpaul youd lose your wagerespecially in oil probably the commodity most dominated by financial speculation one of macros favorite thing to speculate onhedge with financial vs commercial is like 8020 these days was the other way around before electronic trading started in 1999,NEGATIVE,-1
1816,mark_dow,Dow,2022-09-22,scotiahodl this might help httpstcohooj8bf5ox,NEGATIVE,-1
1817,mark_dow,Dow,2022-09-19,scotiahodl its not a breakout until it breaks out of a range no cherry picking,NEGATIVE,-1
1818,mark_dow,Dow,2022-09-19,scotiahodl i admire your determination to pin it to 71 but the evidence in the us and worldwide points to the early 80s,POSITIVE,1
1819,mark_dow,Dow,2022-09-19,oil goes up on insufficient supply from policy mistakes and oil goes down on weak demand from policy mistakes its never about speculative excesses and swings because marketsespecially oil marketsare efficient httpstcowtinz4xwvk,NEGATIVE,-1
1820,mark_dow,Dow,2022-09-19,scotiahodl httpstcocfdy5vc5cd,NEGATIVE,-1
1821,mark_dow,Dow,2022-09-19,"johnhempton gscapsf more like early 80s
httpstcoxqp8hshtww",NEGATIVE,-1
1822,mark_dow,Dow,2022-09-19,notice how inequality started picking up everywhere in the early 80s even if from different levels as jcecon points out httpstcoxqp8hshtww,NEGATIVE,-1
1823,mark_dow,Dow,2022-09-19,scotiahodl if it were a stock chart youd pinpoint the breakout at 1981,NEGATIVE,-1
1824,mark_dow,Dow,2022-09-19,always has been httpstcowlki5coswo,NEGATIVE,-1
1825,mark_dow,Dow,2022-09-19,"funfact income inequality in the us started growing rapidly around 1980 

i guess it doesnt trickle down httpstcolsmmq2eat6",NEGATIVE,-1
1826,mark_dow,Dow,2022-09-19,rt jgreco thestalwart investors believe the net present value of all of the coin’s future free cash flows are worth less,NEGATIVE,-1
1827,mark_dow,Dow,2022-09-19,by now rogers should be looking into the tax advantages of leasing rather than just owning the bears outright,NEGATIVE,-1
1828,mark_dow,Dow,2022-09-19,blacklioncta idk but the bigger issue is that if you don’t normalize for yield level this index is going to give you a misleading picture of treasury liquidity,NEGATIVE,-1
1829,mark_dow,Dow,2022-09-19,leothebengal ‘night httpstcoapwitsy4jt,NEGATIVE,-1
1830,mark_dow,Dow,2022-09-19,httpstcoptkzbsubbm,NEGATIVE,-1
1831,mark_dow,Dow,2022-09-19,"1
  b
      i
        t
         c
           o
             i
              n
               
                 1
                  b
                    i
                     t
                     c
                     o
                      i 
                     n",NEGATIVE,-1
1832,mark_dow,Dow,2022-09-19,coiners neveragain bitcoin httpstco5ddnscx67s,NEGATIVE,-1
1833,mark_dow,Dow,2022-09-19,rt profesordoval lana del rey httpstcohiccbueofo,NEGATIVE,-1
1834,mark_dow,Dow,2022-09-19,volatilitywiz why isn’t your first guess “there must be some information i’m missing” rather than assume the fed is being shady,NEGATIVE,-1
1835,mark_dow,Dow,2022-09-19,noahpinion or maybe he did but got it wrong 😑,NEGATIVE,-1
1836,mark_dow,Dow,2022-09-19,smartkarma 21mfox thx,NEGATIVE,-1
1837,mark_dow,Dow,2022-09-19,pretty sure this pup just wanted his chair back so he could nap darth httpstcobs7nw3jgro,NEGATIVE,-1
1838,mark_dow,Dow,2022-09-19,"higher level of yields will mathematically produce a larger average yield error in bps even if the liquidity and volatility remain unchanged 

in fact if you look yields started going up in late 2021 right about the same time this index did httpstcojvm97611qf",NEGATIVE,-1
1839,mark_dow,Dow,2022-09-19,jamesd45 normalhumanfun ackmanforever mattgaetz cassidy hutchinson testified to it under oath already back in june multiple sworn sources now,NEGATIVE,-1
1840,mark_dow,Dow,2022-09-19,colemanrod that would make sense i couldn’t tell what was going on from that distance but i cloud see there were helicopters buzzing around it,NEGATIVE,-1
1841,mark_dow,Dow,2022-09-19,the entire island is without power could also be a campaign slogan there,NEGATIVE,-1
1842,mark_dow,Dow,2022-09-19,calvinayre mattgaetz unfortunately libertarian ideas rest on a degree of personal responsibility and self reliance that while admirable in the abstract not only doesn’t exist but keeps not happening when we try and wish it into existence,NEGATIVE,-1
1843,mark_dow,Dow,2022-09-19,the run of swells of late have uncovered the remnants of aliso pier never seen this before miss that pier tho httpstcorsda0eiszr,POSITIVE,1
1844,mark_dow,Dow,2022-09-19,trump going hard after mattgaetz httpstcoyopuau8yxd,NEGATIVE,-1
1845,mark_dow,Dow,2022-09-19,httpstcon0l4ogtffq,NEGATIVE,-1
1846,mark_dow,Dow,2022-09-19,us military coming in close probably to watch and learn from seal team sticks training session httpstcowkzi6pwzsx,NEGATIVE,-1
1847,mark_dow,Dow,2022-09-19,rt generaltheorist markdow think there is a stockflow problem at this time the real economy is still working off the wealth shock fro…,NEGATIVE,-1
1848,mark_dow,Dow,2022-09-19,generaltheorist i think so too youd kind of have to decompose country by country and compare with heavily covid bolstered balance sheet conditions i think,NEGATIVE,-1
1849,mark_dow,Dow,2022-09-19,peakstopac probably not but youd have to decompose it country by country and contrast with initial balance sheet conditions to really see i just wanted to make sure ppl understood what they were looking at and underscore how base money is fundamentally different from broad money,NEGATIVE,-1
1850,mark_dow,Dow,2022-09-19,"rt coachbench kramer………
weekendsmiles httpstcokuxyjlxoxt httpstco66picyumqt",NEGATIVE,-1
1851,mark_dow,Dow,2022-09-19,ftr this is not central banks withdrawing base money from the system this is the endogenous credit creation mechanism ie risk appetite of lenders and borrowers which ultimately matters more httpstcolavs50jwvr,NEGATIVE,-1
1852,mark_dow,Dow,2022-09-19,5 hábitos para cumplir con el fmi httpstcogucokbntyw,NEGATIVE,-1
1853,mark_dow,Dow,2022-09-19,rt bennpeifert this is the why of crypto httpstco6gtxgsngbo,NEGATIVE,-1
1854,mark_dow,Dow,2022-09-19,rt nunoclara behavioral biases distribution is pretty normal but 95 always rounds to 100 httpstcol0ofmnzvfj,NEGATIVE,-1
1855,mark_dow,Dow,2022-09-19,done kwon,POSITIVE,1
1856,mark_dow,Dow,2022-09-19,rt muellershewrote never forget matt gaetz and his dad were prepared to pay 15m for a pardon for matty’s sex trafficking,NEGATIVE,-1
1857,mark_dow,Dow,2022-09-19,rt slendersherbet otters on a water slide is the start to your weekend that you didnt know you needed httpstco93mukqt6uz,NEGATIVE,-1
1858,mark_dow,Dow,2022-09-19,or… httpstcopi91rlimso httpstco06iahsz0ji,NEGATIVE,-1
1859,mark_dow,Dow,2022-09-19,kgreifeld httpstcomoodry0php,NEGATIVE,-1
1860,mark_dow,Dow,2022-09-19,raise your hand if you still take your salary in crypto httpstco0yqotdpxmw,NEGATIVE,-1
1861,mark_dow,Dow,2022-09-19,mikealfred plus they’ve boiled so many boomer brains,NEGATIVE,-1
1862,mark_dow,Dow,2022-09-19,darioperkins bernard22190947 merlialess i’m ready httpstcofcimarxzf3,NEGATIVE,-1
1863,mark_dow,Dow,2022-09-19,darioperkins merlialess la sicilia is on the docket for later this year i think i havent been there either november looks like a pleasant month there weatherwise but i do hear good things about calabria too,POSITIVE,1
1864,mark_dow,Dow,2022-09-19,xvrmdf hai capito tutto caro,NEGATIVE,-1
1865,mark_dow,Dow,2022-09-19,darioperkins merlialess for ragù yes in bologna canonico pappardelle are great but la loro morte e con funghiporcini,POSITIVE,1
1866,mark_dow,Dow,2022-09-19,darioperkins merlialess pappardelle are excellent maybe only pasta better for it is tagliatelle great with polenta too,POSITIVE,1
1867,mark_dow,Dow,2022-09-19,darioperkins merlialess have done the empirical testing large sample size,NEGATIVE,-1
