,username.1,name,day of publication,textclean,sentiment,helper
0,Degennaroinvest,Cataldo De gennaro,2022-11-09,rt saylor the prices may gyrate the players may change but the song remains the same bitcoin httpstcotreaqfmylv,NEGATIVE,-1
1,Degennaroinvest,Cataldo De gennaro,2022-11-09,"i believe everybody can make a small contribution towards climate change by investing in great renewable energy companies i made mine plug i do have a strong conviction on green hydrogen 🚀🚀🚀🤌😉
enph sedg tsla",POSITIVE,1
2,Degennaroinvest,Cataldo De gennaro,2022-11-09,"httpstcosisqmkkajn

great news for plug
great news for our portfolio 🥂",POSITIVE,1
3,Degennaroinvest,Cataldo De gennaro,2022-11-09,rt plugpowerinc just got off bloomberg tv  highlighted the fact that fuel cells vehicles will have a 30 share of electric vehicles by 2…,POSITIVE,1
4,Degennaroinvest,Cataldo De gennaro,2022-11-09,"bionano genomics announces first publication using ogm for detection of repeat expansions in canvas and adultonset ataxia httpstco4k41odlpqf

great news for our e investment portfolio
workfromhome investing investment stockmarket stocks stocktraders etoro",POSITIVE,1
5,Degennaroinvest,Cataldo De gennaro,2022-11-09,plug climatechange stock cleanenergy  httpstcohl7iqwsont,NEGATIVE,-1
6,Degennaroinvest,Cataldo De gennaro,2022-11-09,rt plugpowerinc the key to helping europe reach its carbon reduction targets on time green hydrogen plug ceo andy marsh spoke with see…,POSITIVE,1
7,Degennaroinvest,Cataldo De gennaro,2022-11-09,rt igorsushko russia heres a concert in stpetersburg entire crowd is chanting fk war fk war fk war ✊ russianpeople are t…,NEGATIVE,-1
8,Degennaroinvest,Cataldo De gennaro,2022-11-09,rt plugpowerinc we’re excited to announce that we’ve landed an order to deliver a 1gw electrolyzer to swiss hydrogen company h2 energy –…,POSITIVE,1
9,Degennaroinvest,Cataldo De gennaro,2022-11-09,"kulkan2017 i just keep on accumulating  at these prices it’s a bargain
this will be a trillion dollar market per annum what will the price be when that will come to reality 😉",NEGATIVE,-1
10,Degennaroinvest,Cataldo De gennaro,2022-11-09,"increasing my plugpower position  i want to be part of the greenhydrogen revolution 😉

unlimited resources just saying…",POSITIVE,1
11,Degennaroinvest,Cataldo De gennaro,2022-11-09,rt markminervini httpstcontgrdbi1vo,NEGATIVE,-1
12,Degennaroinvest,Cataldo De gennaro,2022-11-09,rt billackman if the russians could see this the war would be over tomorrow,NEGATIVE,-1
13,Degennaroinvest,Cataldo De gennaro,2022-11-09,sarahkatilyn 😂😂🤣🤣,POSITIVE,1
14,Degennaroinvest,Cataldo De gennaro,2022-11-09,"sarahkatilyn well if your profile picture is recent no it’s not too late 😉
i’m not flirting",POSITIVE,1
15,Degennaroinvest,Cataldo De gennaro,2022-11-09,sarahkatilyn it’s never to late,POSITIVE,1
16,Degennaroinvest,Cataldo De gennaro,2022-11-09,sarahkatilyn naughty 😀,NEGATIVE,-1
17,Degennaroinvest,Cataldo De gennaro,2022-11-09,rt benzinga watch out for those pump amp dumps🦈 httpstco80ps1ku5dd,NEGATIVE,-1
18,Degennaroinvest,Cataldo De gennaro,2022-11-09,"i’m fully invested on what’s coming next…

nvda unity rblx nsdq nvda

httpstcoppi9bthnsu",POSITIVE,1
19,mark_dow,Dow,2022-12-08,randallgrahm dommage sounds like a great dish tho,NEGATIVE,-1
20,mark_dow,Dow,2022-12-08,randallgrahm which wines did you serve with it,POSITIVE,1
21,mark_dow,Dow,2022-12-08,proof of reserves httpstcoc1j9do5czh,NEGATIVE,-1
22,mark_dow,Dow,2022-12-08,“liquidity we got liquidity just not right now”,NEGATIVE,-1
23,mark_dow,Dow,2022-12-08,live shot of kevin o’leary explaining his process httpstcovvvbnqmlox,NEGATIVE,-1
24,mark_dow,Dow,2022-12-08,wen recession ser,NEGATIVE,-1
25,mark_dow,Dow,2022-12-08,pretty sure bloomberg tv pays kevin oleary to be on cnbc,NEGATIVE,-1
26,mark_dow,Dow,2022-12-08,excellent news httpstcoudptxpk3g5,POSITIVE,1
27,mark_dow,Dow,2022-12-08,i guess this settles the debate about whether twitter was one of the factors weighing on tsla stock since elmo took over httpstcorumrmizkqg,NEGATIVE,-1
28,mark_dow,Dow,2022-12-08,castillo to trump hold my pisco sour httpstcopx5kv6nqrx,NEGATIVE,-1
29,mark_dow,Dow,2022-12-08,raise your hand if you’re seeing inflows httpstcopgs5trqaan,POSITIVE,1
30,mark_dow,Dow,2022-12-08,gromanic perfect crew,POSITIVE,1
31,mark_dow,Dow,2022-12-08,rt priapusiq 🔥 fantastic effort from mr berthofmanecon,POSITIVE,1
32,mark_dow,Dow,2022-12-08,rt markdow this gentleman is well informed won’t please the crowd that wants to be angry at stuff but he knows what he’s talking about…,POSITIVE,1
33,mark_dow,Dow,2022-12-08,“the plan was to attack the german parliament in berlin and insert the prince as new head of state” httpstco67sxlxleyk,NEGATIVE,-1
34,mark_dow,Dow,2022-12-08,"rt ivanthek a little over 10 years ago business insider did a list of 101 finance people you have to follow on twitter

most of these…",POSITIVE,1
35,mark_dow,Dow,2022-12-08,httpstcou5s7pqsriu httpstcom47qkwkpao,NEGATIVE,-1
36,mark_dow,Dow,2022-12-08,rt markdow when bankrupting el salvador isnt enough bitcoin,NEGATIVE,-1
37,mark_dow,Dow,2022-12-08,rt markdow micron,POSITIVE,1
38,mark_dow,Dow,2022-12-08,this gentleman is well informed won’t please the crowd that wants to be angry at stuff but he knows what he’s talking about httpstcor5d78a4g4q,POSITIVE,1
39,mark_dow,Dow,2022-12-08,rt thedailyshow breaking lindsey graham has called raphael warnock to concede for herschel walker,NEGATIVE,-1
40,mark_dow,Dow,2022-12-08,pretty sure weve passed the point to where the dems now want trump to be the candidate,NEGATIVE,-1
41,mark_dow,Dow,2022-12-08,macropunter bigbluebugcap we do for sure but id argue social media is 4x the speed and intensity,NEGATIVE,-1
42,mark_dow,Dow,2022-12-08,c’est toujours mon côté mauvais qui parle,POSITIVE,1
43,mark_dow,Dow,2022-12-08,kczat few,NEGATIVE,-1
44,mark_dow,Dow,2022-12-08,micron httpstcoynndiauaqa,NEGATIVE,-1
45,mark_dow,Dow,2022-12-08,if this werent my country id be laughing a lot harder,NEGATIVE,-1
46,mark_dow,Dow,2022-12-08,its not over until trump tweets he never knew herschel walker,NEGATIVE,-1
47,mark_dow,Dow,2022-12-08,bigbluebugcap macropunter developing a good filter is everything,NEGATIVE,-1
48,mark_dow,Dow,2022-12-08,joseluisdazany like capitalism its the least bad,NEGATIVE,-1
49,mark_dow,Dow,2022-12-08,live shot of herschel walker httpstcopbarf0qysr,NEGATIVE,-1
50,mark_dow,Dow,2022-12-08,rt projectlincoln kowtowing to farright election deniers and trump sycophants is causing big problems for the gop if only there was an…,NEGATIVE,-1
51,mark_dow,Dow,2022-12-08,hey czbinance can you just pull the plug on all this tether bullshit already so we can get this derisking over with,NEGATIVE,-1
52,mark_dow,Dow,2022-12-08,macropunter bigbluebugcap if someones reasoning is off i dont care if they end up being right or not cant trust em,NEGATIVE,-1
53,mark_dow,Dow,2022-12-08,ronpike jeffandersoncpa we want a competitive gop but we need to purge trump and anyone who enabled or supported him for that to happen,NEGATIVE,-1
54,mark_dow,Dow,2022-12-08,jeffandersoncpa every decent republican should want the gop to lose as much as possible rn to purge anything trump or trump adjacent only credible way forward if the gop wants to pull from the center again as the french say reculer pour mieux sauter,NEGATIVE,-1
55,mark_dow,Dow,2022-12-08,macropunter bigbluebugcap hey macro p outside of the plumbing space hes just making shit up for clicks basically,NEGATIVE,-1
56,mark_dow,Dow,2022-12-08,sonnyda63794865 not even close,NEGATIVE,-1
57,mark_dow,Dow,2022-12-08,lets hope herschel walker ends up being the absolute low water mark of the trump era gop at some point some semblance of integrity and self respect has to return no other way for the gop to become competitive again,POSITIVE,1
58,mark_dow,Dow,2022-12-08,bauhiniacapital totally,POSITIVE,1
59,mark_dow,Dow,2022-12-08,httpstcotumrswuuql,NEGATIVE,-1
60,mark_dow,Dow,2022-12-08,its just jaw dropping to think herschel walker would be a serious candidate for anything other than a lobotomy ad,NEGATIVE,-1
61,mark_dow,Dow,2022-12-08,if a sequoia falls in the forest httpstco0oojzbngqt,NEGATIVE,-1
62,mark_dow,Dow,2022-12-08,rt bigbluebugcap i’ll save you all some time  the first 3 sentences are all you need to read the rest is zoltan opining on things he is…,NEGATIVE,-1
63,mark_dow,Dow,2022-12-08,nikkadensok kevinmuir you cant learn from george gammon ideologyesp hisdoesnt make you money in markets,POSITIVE,1
64,mark_dow,Dow,2022-12-08,macropotamus ivanthek yeah obviously abstracting from nuance and idiosyncrasies market to market but the general direction of our collective bias,NEGATIVE,-1
65,mark_dow,Dow,2022-12-08,dfin24 httpstcohh6t1yx0w6,NEGATIVE,-1
66,mark_dow,Dow,2022-12-08,the hill still trying to make border happen httpstcoccdq2ybaer,NEGATIVE,-1
67,mark_dow,Dow,2022-12-08,macropotamus ivanthek honestly think long end levels have much more to do with supplydemand of long term saving instruments than econ fundies perception of fundies matters mostly for deltas but not so much for levels imo,NEGATIVE,-1
68,mark_dow,Dow,2022-12-08,gtcost ok noted you think a president committing multiple frauds is no big deal,NEGATIVE,-1
69,mark_dow,Dow,2022-12-08,rpathree httpstcohllnimxdqu,NEGATIVE,-1
70,mark_dow,Dow,2022-12-08,bayc update httpstcoaaypmtibwx,NEGATIVE,-1
71,mark_dow,Dow,2022-12-08,httpstcoj6ec9q7phs,NEGATIVE,-1
72,mark_dow,Dow,2022-12-08,guilty on all counts is the new trump tagline,POSITIVE,1
73,mark_dow,Dow,2022-12-08,johnjdrumm1 i dont think this is true,NEGATIVE,-1
74,mark_dow,Dow,2022-12-08,rt arishisays breaking stocks go down after going up as they have done several times over the last few months in light of the latest s…,NEGATIVE,-1
75,mark_dow,Dow,2022-12-08,guapísimo httpstcozqpeedhfxg,NEGATIVE,-1
76,mark_dow,Dow,2022-12-08,i mean right,POSITIVE,1
77,mark_dow,Dow,2022-12-08,a soft landing would bust so many newsletters and youtubers httpstcoyclauxrfki,NEGATIVE,-1
78,mark_dow,Dow,2022-12-08,she kept the handsome one httpstcoabp8fq8wrw,POSITIVE,1
79,mark_dow,Dow,2022-12-08,pouring one out for hunter bidens laptop httpstcoi98oluvaab,NEGATIVE,-1
80,mark_dow,Dow,2022-12-08,the soft landing will vindicate the view that interest rates are not nearly as powerful for the real economy as has traditionally been thought,NEGATIVE,-1
81,mark_dow,Dow,2022-12-08,a whole lot of projection going on here remember the way the dems turned on cuomo as soon as credible evidence surfaced yeah republicans dont do that httpstcof1al1wokjk,NEGATIVE,-1
82,mark_dow,Dow,2022-12-08,we all would httpstcorlh3wasnbp,NEGATIVE,-1
83,mark_dow,Dow,2022-12-08,geonv haha loser gets benidorm,NEGATIVE,-1
84,mark_dow,Dow,2022-12-08,internetuser43 but portugal is the iberian peninsula,NEGATIVE,-1
85,mark_dow,Dow,2022-12-08,portugal fala,POSITIVE,1
86,mark_dow,Dow,2022-12-08,stevenj1279 haha,NEGATIVE,-1
87,mark_dow,Dow,2022-12-08,ivanthek haha true tho ive always been skeptical of yield levels telling us much of anything,NEGATIVE,-1
88,mark_dow,Dow,2022-12-08,who do you want to win switzerland or portugal,POSITIVE,1
89,mark_dow,Dow,2022-12-08,yield curve inversion it’s different this time httpstcobqiho7dtla,NEGATIVE,-1
90,mark_dow,Dow,2022-12-08,when doing a gram meant an entirely different thing httpstcod0b23ncboa,NEGATIVE,-1
91,mark_dow,Dow,2022-12-08,way better than running twitter httpstconkhpjkfmim,POSITIVE,1
92,mark_dow,Dow,2022-12-08,cropduster101 last i checked switzerland wasnt a muslim country,NEGATIVE,-1
93,mark_dow,Dow,2022-12-08,ibexsalad pois pois,NEGATIVE,-1
94,mark_dow,Dow,2022-12-08,apart from the violence trump will no doubt try to incite the pivot from running for president to running from jail is going to be beautiful httpstcouwvnkdpruf,POSITIVE,1
95,mark_dow,Dow,2022-12-08,up to portugal now to defend the honor of the peninsula,POSITIVE,1
96,mark_dow,Dow,2022-12-08,ialdasoro jaja,POSITIVE,1
97,mark_dow,Dow,2022-12-08,breaking ceuta and melilla,NEGATIVE,-1
98,mark_dow,Dow,2022-12-08,richardoakes9 we all feel more nervous near the end of a derisking than we do near the beginning,NEGATIVE,-1
99,mark_dow,Dow,2022-12-08,pro bono,POSITIVE,1
100,mark_dow,Dow,2022-12-08,más se perdió en cuba too soon,NEGATIVE,-1
101,mark_dow,Dow,2022-12-08,morocco earned this well done,POSITIVE,1
102,mark_dow,Dow,2022-12-08,la la la,NEGATIVE,-1
103,mark_dow,Dow,2022-12-08,however this turns out hats off to moroccos defensive grit and grind respect hamdullah,NEGATIVE,-1
104,mark_dow,Dow,2022-12-08,darioperkins andreassteno richardtcasey correct,POSITIVE,1
105,mark_dow,Dow,2022-12-08,bobadils mom would be proud of moroccos defense,POSITIVE,1
106,mark_dow,Dow,2022-12-08,venga vamos,POSITIVE,1
107,mark_dow,Dow,2022-12-08,evizerate since 1492,POSITIVE,1
108,mark_dow,Dow,2022-12-08,pragmatictake yeah lots of talent on that pitch,POSITIVE,1
109,mark_dow,Dow,2022-12-08,extra time no moor bets,POSITIVE,1
110,mark_dow,Dow,2022-12-08,they sold out backing the policefor trump httpstco5qn9dphdsz,NEGATIVE,-1
111,mark_dow,Dow,2022-12-08,ivanthek hehe,POSITIVE,1
112,mark_dow,Dow,2022-12-08,ivanthek econ activity,POSITIVE,1
113,mark_dow,Dow,2022-12-08,ivanthek prob a decent correlation between credit checks and econ activity,POSITIVE,1
114,mark_dow,Dow,2022-12-08,would be negligent if it didnt given all we know httpstco0xbcb9qqww,NEGATIVE,-1
115,mark_dow,Dow,2022-12-08,an10nev ok but all thats 2nd orderesp in crisis lemme put it this way how much more useful is the spr when consumption is 2x production vs when consumption is 1x production,NEGATIVE,-1
116,mark_dow,Dow,2022-12-08,"that timetested fintwit thing when you say x is less important than it used to be and you get flooded with what do you mean x isnt important

in case you missed class that day less important  not important",NEGATIVE,-1
117,mark_dow,Dow,2022-12-08,an10nev yes but these are all 2nd order issues the spr was created bc we consumed way more than we produced and this is no longer the case,NEGATIVE,-1
118,mark_dow,Dow,2022-12-08,godblsmnymkr seriously think it thru,NEGATIVE,-1
119,mark_dow,Dow,2022-12-06,funfact the utility of the spr changed and declined once the us became self sufficient in oil production,NEGATIVE,-1
120,mark_dow,Dow,2022-12-06,weve gone from the taponshoulder puke out phase of the derisking to the sweating out phase of the derisking,NEGATIVE,-1
121,mark_dow,Dow,2022-12-06,"market update

aapl httpstcouyxmyrya3w",NEGATIVE,-1
122,mark_dow,Dow,2022-12-06,wen financing souki  tellurianlng tell httpstco00sbvvytn5,NEGATIVE,-1
123,mark_dow,Dow,2022-12-06,were overdue for another vibe recession,NEGATIVE,-1
124,mark_dow,Dow,2022-12-06,rt josephpolitano love when vcs talk about how rising interest rates and worse macro conditions ruined their investments when their inves…,POSITIVE,1
125,mark_dow,Dow,2022-12-06,thezachbroyles i mean if youve only been bullish for 18 months since 2004 its probably your nature and not analysis,NEGATIVE,-1
126,mark_dow,Dow,2022-12-06,rosie actually the hours we thought about working declined by 015 and that means weve been in a recession since 2003,NEGATIVE,-1
127,mark_dow,Dow,2022-12-06,it doesnt have long to live tragically one of the most beautiful roads on earth httpstcog6ly5zjqje,POSITIVE,1
128,mark_dow,Dow,2022-12-06,sirripsters catheter,NEGATIVE,-1
129,mark_dow,Dow,2022-12-06,riverdaleboy the hopebelief at the time was that economic and financial integration would give an incentive to democratize over time applied to russia too it wasnt a stupid bet to make but it didnt work,NEGATIVE,-1
130,mark_dow,Dow,2022-12-06,brazilbrian ojo once you start you can never stop,POSITIVE,1
131,mark_dow,Dow,2022-12-06,and still has no clue what time it is httpstcodhrk8oeikb,NEGATIVE,-1
132,mark_dow,Dow,2022-12-06,noahpinion i did not whats the tldr,NEGATIVE,-1
133,mark_dow,Dow,2022-12-06,the symbiotic relationship was the us and europe trying to facilitate china catching up and integrating itself into global leadership an honest bet gone wrong also useful to remember the context neoliberal consensus was trickle down free trade even the dems back then httpstcobtklmzjowr,POSITIVE,1
134,mark_dow,Dow,2022-12-06,ampyourgrowth ha i don’t even know what that is,NEGATIVE,-1
135,mark_dow,Dow,2022-12-06,ampyourgrowth its terrible need to delete,NEGATIVE,-1
136,mark_dow,Dow,2022-12-06,rooster cogburn is his name iykyk httpstco756sxygbqu,NEGATIVE,-1
137,mark_dow,Dow,2022-12-06,low tick close,NEGATIVE,-1
138,mark_dow,Dow,2022-12-06,hmeisler stocktonkatie stock ton must be her stage name,NEGATIVE,-1
139,mark_dow,Dow,2022-12-06,bitcoin httpstcob2clsiuv2u,NEGATIVE,-1
140,mark_dow,Dow,2022-12-06,narrativemachi1 that 60 in elbow and shoulder years,NEGATIVE,-1
141,mark_dow,Dow,2022-12-06,juanrive coyote packs are super crafty thats one tough and committed pup,POSITIVE,1
142,mark_dow,Dow,2022-12-06,not all heroes wear collars httpstcow6imsvod0n,NEGATIVE,-1
143,mark_dow,Dow,2022-12-06,brazilkorea update httpstcobiwt4yae5v,NEGATIVE,-1
144,mark_dow,Dow,2022-12-06,ok but brazil is rubbish at kpop,NEGATIVE,-1
145,mark_dow,Dow,2022-12-06,o creme sobe,NEGATIVE,-1
146,mark_dow,Dow,2022-12-06,we went from spr release wont work to ok it works but its too risky and irresponsible pretty seamlessly,NEGATIVE,-1
147,mark_dow,Dow,2022-12-06,harmzway88 httpstcomzcnip4r93,NEGATIVE,-1
148,mark_dow,Dow,2022-12-06,nigerian emails incoming in 321 httpstcojuakqosdxg,NEGATIVE,-1
149,mark_dow,Dow,2022-12-06,rt markdow seriously though if you fell for trump and you fell for shitcoins how could you expect anyone to trust your judgment finan…,NEGATIVE,-1
150,mark_dow,Dow,2022-12-06,rt asfa mes bananes se sont suicidées cette nuit httpstcovtlk8muclq,NEGATIVE,-1
151,mark_dow,Dow,2022-12-06,"rt markdow trump also tried to get snl canceled because of alex baldwin‘s imitation of him 

nevertrumpers were right about trump the…",NEGATIVE,-1
152,mark_dow,Dow,2022-12-06,rt markdow httpstcoiipxf0dhqs,NEGATIVE,-1
153,mark_dow,Dow,2022-12-06,when bankrupting el salvador isnt enough bitcoin httpstcojuakqosdxg,NEGATIVE,-1
154,mark_dow,Dow,2022-12-06,buytheindex i think youre confused theyre not talking about mississippi,NEGATIVE,-1
155,mark_dow,Dow,2022-12-06,lincolnsamelson probably not more likely elon is lying because he has a long history of lying and a huge incentive to lie in this case,NEGATIVE,-1
156,mark_dow,Dow,2022-12-06,ttw after 12 years of usecase promises this is what youre left with httpstcojuakqosdxg,NEGATIVE,-1
157,mark_dow,Dow,2022-12-06,well done livaković,POSITIVE,1
158,mark_dow,Dow,2022-12-06,殺人本能,POSITIVE,1
159,mark_dow,Dow,2022-12-06,being truthful is not one of his gifts httpstcomcj34z6gmk,NEGATIVE,-1
160,mark_dow,Dow,2022-12-06,love the croat fans with the national water polo caps few,POSITIVE,1
161,mark_dow,Dow,2022-12-06,rt royfromonline wake up babe new odd lots pod cast,POSITIVE,1
162,mark_dow,Dow,2022-12-06,japan really wants this,POSITIVE,1
163,mark_dow,Dow,2022-12-06,rt dontshowyourcat the signal httpstcovtj6cexnu1,NEGATIVE,-1
164,mark_dow,Dow,2022-12-06,four seasons total disbarment httpstco8l2d923knv,NEGATIVE,-1
165,mark_dow,Dow,2022-12-06,dustinmulvaney nwsbayarea the weatherbeaten westside,NEGATIVE,-1
166,mark_dow,Dow,2022-12-06,"rt commanders happy birthday to the legend 

zipscleaners  httc httpstcofqxxwu0fj6",POSITIVE,1
167,mark_dow,Dow,2022-12-06,avi change will bring the laser eyes back when bitcoin gets below 10k,NEGATIVE,-1
168,mark_dow,Dow,2022-12-06,that was some athleticism right there,POSITIVE,1
169,mark_dow,Dow,2022-12-06,httpstcoiipxf0dhqs httpstcoylrpj5g90r,NEGATIVE,-1
170,mark_dow,Dow,2022-12-06,bears defense today httpstcoa4kkomafjt,NEGATIVE,-1
171,mark_dow,Dow,2022-12-06,rt lizcheney donald trump believes we should terminate “all rules regulations and articles even those found in the constitution” to ov…,NEGATIVE,-1
172,mark_dow,Dow,2022-12-06,rt espiers some of this is generational people ben’s age see both sidesism for the dishonesty that it is and people glenn’s age think i…,NEGATIVE,-1
173,mark_dow,Dow,2022-12-06,dillyri central coast,POSITIVE,1
174,mark_dow,Dow,2022-12-06,httpstcoxaadcs5vnn,NEGATIVE,-1
175,mark_dow,Dow,2022-12-06,ricardovlago dandolfa it definitely could but in this case the objective of keeping inflation expectations anchored has been pretty clear all along imo even if one disagrees with how they pursued it,NEGATIVE,-1
176,mark_dow,Dow,2022-12-06,rt dandolfa it seems literally impossible to convey the notion of datadependent policy to the general public or even some sophisticated…,NEGATIVE,-1
177,mark_dow,Dow,2022-12-06,ricardovlago dandolfa not so much if the objectives dont change,NEGATIVE,-1
178,mark_dow,Dow,2022-12-06,"rt gmck2012 breaking putin agrees to withdraw from ukraine if uk nurses agree to take a 4 pay rise 

bbclaurak httpstco9wr5en0818",NEGATIVE,-1
179,mark_dow,Dow,2022-12-06,emh always brings itand not just the memes dude has serious game thank you for the common sense effmkthype httpstcofdrxacsmlg,POSITIVE,1
180,mark_dow,Dow,2022-12-06,"were tired of looking backwards

translation we supported trump and dont want to be held accountable for our wholesale abdication of principle morality and character",NEGATIVE,-1
181,mark_dow,Dow,2022-12-06,listen to the sound when the shot comes off his foot httpstcosl8aj4ag5g,NEGATIVE,-1
182,mark_dow,Dow,2022-12-06,bennpeifert httpstcopwrb8i7vso,NEGATIVE,-1
183,mark_dow,Dow,2022-12-06,his tweeting hyperbolic promises and distractions probably saved tsla from going bankrupt in 201718 httpstcoubxmcmisrd,NEGATIVE,-1
184,mark_dow,Dow,2022-12-06,eetheridge no one said he died,NEGATIVE,-1
185,mark_dow,Dow,2022-12-06,watch mama cheetah on her game httpstcogk8bs3axpg,NEGATIVE,-1
186,mark_dow,Dow,2022-12-06,shane didnt come back httpstcomgedichxjd,NEGATIVE,-1
187,mark_dow,Dow,2022-12-06,"rt colbertlateshow nobel peace prize winner mariaressa says social media has “come in and used free speech to stifle free speech”

col…",NEGATIVE,-1
188,mark_dow,Dow,2022-12-06,rt modestproposal1 belief in conspiracy theories has become the default midwit position,NEGATIVE,-1
189,mark_dow,Dow,2022-12-06,"rt shaneaparrish the highest form of wealth is the ability to wake up every morning and say i can do whatever i want today 

— mor…",POSITIVE,1
190,mark_dow,Dow,2022-12-06,"trump also tried to get snl canceled because of alex baldwin‘s imitation of him 

nevertrumpers were right about trump the experts were right about trump the coastal elites were right about trump trump derangement syndrome was right about trump httpstcooajp9ofzmq",NEGATIVE,-1
191,mark_dow,Dow,2022-12-06,got to love the fight in the aussies respect,POSITIVE,1
192,mark_dow,Dow,2022-12-06,"rt sobelmark private creditors always wish to lay off losses on the imfmdbs or citizens of stressed country — let them eat cake 

do t…",NEGATIVE,-1
193,mark_dow,Dow,2022-12-06,brought soccer to a football game,POSITIVE,1
194,mark_dow,Dow,2022-12-06,httpstcopkqyiydzcz,NEGATIVE,-1
195,mark_dow,Dow,2022-12-06,rt yoda4ever furry snake🐈🐾🐍😅 httpstco1cdnrcfao9,NEGATIVE,-1
196,mark_dow,Dow,2022-12-06,financial participants progressively ratcheting up liquidity and maturity mismatches is pretty much the defining characteristic of all risk cycles irrespective of interest rate level httpstcoe23aamrahz,NEGATIVE,-1
197,mark_dow,Dow,2022-12-06,great thread underscores how important it is for the regulatory framework to keep concentrated tail risk out of the systemically important entities the risk has to reside somewhere and smaller peripheral entities won’t generate anywhere near the same kind of collateral damage httpstconzogkk89pp,NEGATIVE,-1
198,mark_dow,Dow,2022-12-06,“my call for a recession six months ago still stands”,NEGATIVE,-1
199,mark_dow,Dow,2022-12-06,free speech for thee but not for ye,NEGATIVE,-1
200,mark_dow,Dow,2022-12-06,inferring the fed’s policy stance from the price action immediately after a fed announcement dot substack dot com,NEGATIVE,-1
201,mark_dow,Dow,2022-12-06,"1 powell delivers a message

2 market doesn’t listen

3 market loses money

4 market blames powell’s communication",NEGATIVE,-1
202,mark_dow,Dow,2022-12-06,rt jmhorp there were no lockdowns in the us,NEGATIVE,-1
203,mark_dow,Dow,2022-12-06,excellent news couldn’t think of a better candidate httpstcojumkjrfm4j,POSITIVE,1
204,mark_dow,Dow,2022-12-06,when you turn the corner around santa barbara the pacific just gets so much more aggressive,NEGATIVE,-1
205,mark_dow,Dow,2022-12-06,scenes from myst httpstcobfjoiiii9s,NEGATIVE,-1
206,mark_dow,Dow,2022-12-06,the wild coast httpstcoi5pmaks9vd,NEGATIVE,-1
207,mark_dow,Dow,2022-12-06,guy who admits on a podcast that yield farming is a ponzi scheme also underestimates the volatility of crypto collateral in his risk management framework,NEGATIVE,-1
208,mark_dow,Dow,2022-12-06,rt markdow it’s increasingly looking like alameda did a nick leeson that sbf tried to paper over with a bernie madoff,NEGATIVE,-1
209,mark_dow,Dow,2022-12-06,is harold hamm ok,POSITIVE,1
210,mark_dow,Dow,2022-12-06,pro tip don’t confuse price action with policy stance,POSITIVE,1
211,mark_dow,Dow,2022-12-06,lot of people aren’t ready to hear that it’s going to turn out that a lot of the nasty crypto predation wasn’t technically illegal,NEGATIVE,-1
212,mark_dow,Dow,2022-12-06,bitcoin httpstcofn4kj8aoao httpstcokkgiopq5gg,NEGATIVE,-1
213,mark_dow,Dow,2022-12-06,rt pipczar poll time is the sampp above or below 4000 by year end you have till the end of the week to respond spx spx trading stocks,NEGATIVE,-1
214,mark_dow,Dow,2022-12-06,crypto hedge fund httpstco4bkxfrfffp,NEGATIVE,-1
215,mark_dow,Dow,2022-12-06,hasn’t learned to fetch steelhead yet httpstcopefcouhhcm,NEGATIVE,-1
